CODIGO,DISTRITO,DEPARTAMENTO,MUNICIPIO,ESTABLECIMIENTO,DIRECCION,TELEFONO,SUPERVISOR,DIRECTOR,NIVEL,SECTOR,AREA,STATUS,MODALIDAD,JORNADA,PLAN,DEPARTAMENTAL
13-01-0065-46,13-004,HUEHUETENANGO,HUEHUETENANGO,INSTITUTO NORMAL MIXTO ALEJANDRO CORDOVA,6A AVE. A 10-59 ZONA 1,77641157,CLARA ARMIDA MORALES CASTILLO,ADELA MAŔ CALDERON CANO,DIVERSIFICADO,OFICIAL,URBANA,ABIERTA,MONOLINGUE,VESPERTINA,DIARIO(REGULAR),HUEHUETENANGO
13-01-0066-46,13-050,HUEHUETENANGO,HUEHUETENANGO,COLEGIO MIXTO ASTURIAS,2A CALLE 7-32 ZONA 1,77642242,REYNALDO RECINOS CASTILLO,LUIS ENRIQUE VSQUEZ VELSQUEZ,DIVERSIFICADO,PRIVADO,URBANA,CERRADA TEMPORALMENTE,MONOLINGUE,VESPERTINA,DIARIO(REGULAR),HUEHUETENANGO
13-01-0067-46,13-004,HUEHUETENANGO,HUEHUETENANGO,COLEGIO MIXTO ASTURIAS,2A CALLE 7-32 INTERIO ZONA 1,77642242,CLARA ARMIDA MORALES CASTILLO,,DIVERSIFICADO,PRIVADO,URBANA,CERRADA TEMPORALMENTE,MONOLINGUE,NOCTURNA,DIARIO(REGULAR),HUEHUETENANGO
13-01-0068-46,13-050,HUEHUETENANGO,HUEHUETENANGO,COLEGIO DE LA SALLE,10A AVE. 10-00 ZONA 1,77641186,REYNALDO RECINOS CASTILLO,OSCAR FERNANDO MART͎EZ TELLO,DIVERSIFICADO,PRIVADO,URBANA,ABIERTA,MONOLINGUE,MATUTINA,DIARIO(REGULAR),HUEHUETENANGO
13-01-0069-46,13-050,HUEHUETENANGO,HUEHUETENANGO,COLEGIO EVANGELICO MIXTO LA AURORA,5A. CALLE 5-47 ZONA 1,77641328,REYNALDO RECINOS CASTILLO,DAILY RUSB͠GONZLEZ RAMOS,DIVERSIFICADO,PRIVADO,URBANA,ABIERTA,MONOLINGUE,VESPERTINA,DIARIO(REGULAR),HUEHUETENANGO
13-01-0070-46,13-050,HUEHUETENANGO,HUEHUETENANGO,COLEGIO 'DE LA SALLE',10 AVE 10-00 ZONA 1,77641809,REYNALDO RECINOS CASTILLO,---,DIVERSIFICADO,PRIVADO,URBANA,CERRADA TEMPORALMENTE,MONOLINGUE,NOCTURNA,DIARIO(REGULAR),HUEHUETENANGO
13-01-0071-46,13-004,HUEHUETENANGO,HUEHUETENANGO,INSTITUTO PRIVADO MIXTO DE EDUCACION DIVERSIFICADA DE CIENCIAS COMERCIALES,4A AVE. 1-30 ZONA 1,77641343,CLARA ARMIDA MORALES CASTILLO,MARLIN MARIBEL HERNNDEZ CASTILLO,DIVERSIFICADO,PRIVADO,URBANA,CERRADA TEMPORALMENTE,MONOLINGUE,NOCTURNA,DIARIO(REGULAR),HUEHUETENANGO
13-01-0072-46,13-004,HUEHUETENANGO,HUEHUETENANGO,LICEO Y ACADEMIA ADVENTISTA DIEGUEZ OLAVERRI,EL TERRERO ZONA 4,77641463,CLARA ARMIDA MORALES CASTILLO,,DIVERSIFICADO,PRIVADO,URBANA,TEMPORAL TITULOS,MONOLINGUE,MATUTINA,DIARIO(REGULAR),HUEHUETENANGO
13-01-0075-46,13-004,HUEHUETENANGO,HUEHUETENANGO,LICEO PRIVADO DE CIENCIAS COMERCIALES,5TA. AV. 7-112 ZONA 1,77640126,CLARA ARMIDA MORALES CASTILLO,MARLIN MARIBEL HERNNDEZ CASTILLO,DIVERSIFICADO,PRIVADO,URBANA,CERRADA TEMPORALMENTE,MONOLINGUE,VESPERTINA,DIARIO(REGULAR),HUEHUETENANGO
13-01-0079-46,13-050,HUEHUETENANGO,HUEHUETENANGO,"LICEO EVANGELICO ""EL ALBA""",6A AVENIDA 9-17 ZONA 1,77682352,REYNALDO RECINOS CASTILLO,JOSɠRAڌ MART͎EZ XUTUC,DIVERSIFICADO,PRIVADO,URBANA,ABIERTA,MONOLINGUE,VESPERTINA,DIARIO(REGULAR),HUEHUETENANGO
13-01-0112-46,13-050,HUEHUETENANGO,HUEHUETENANGO,INSTITUTO NACIONAL DE EDUCACION DIVERSIFICADA,9. CALLEJӎ B 12-94 ZONA 4 SECTOR LOS OLIVOS EL TERRERO,40124127,REYNALDO RECINOS CASTILLO,HUGO RUBɎ GӍEZ GӍEZ,DIVERSIFICADO,OFICIAL,RURAL,ABIERTA,MONOLINGUE,VESPERTINA,DIARIO(REGULAR),HUEHUETENANGO
13-01-0143-46,13-004,HUEHUETENANGO,HUEHUETENANGO,LICEO PREUNIVERSITARIO DE INFORMATICA,"4A. AVENIDA 1-30, ZONA 1",77648784,CLARA ARMIDA MORALES CASTILLO,NIVEA MARINA RIVAS GUTIɒREZ,DIVERSIFICADO,PRIVADO,URBANA,ABIERTA,MONOLINGUE,MATUTINA,DIARIO(REGULAR),HUEHUETENANGO
13-01-0145-46,13-004,HUEHUETENANGO,HUEHUETENANGO,LICEO PREUNIVERSITARIO DE INFORMATICA,4 AVENIDA 1-30 ZONA 1,77648784,CLARA ARMIDA MORALES CASTILLO,NIVEA MARINA RIVAS GUTIɒREZ,DIVERSIFICADO,PRIVADO,URBANA,ABIERTA,MONOLINGUE,DOBLE,FIN DE SEMANA,HUEHUETENANGO
13-01-0146-46,13-050,HUEHUETENANGO,HUEHUETENANGO,LICEO PRIVADO MIXTO MINERVA,"5A. CALLE 3-28 ZONA 2, BARRIO MINERVA",56993612,REYNALDO RECINOS CASTILLO,ULISES OMAR CALDERӎ CARDONA,DIVERSIFICADO,PRIVADO,URBANA,CERRADA TEMPORALMENTE,MONOLINGUE,DOBLE,FIN DE SEMANA,HUEHUETENANGO
13-01-0156-46,13-050,HUEHUETENANGO,HUEHUETENANGO,COLEGIO SAN FRANCISCO JAVIER DE HUEHUETENANGO,CORRAL CHIQUITO ZONA 8,77208400,REYNALDO RECINOS CASTILLO,LUISA ESMERALDA LӐEZ VSQUEZ,DIVERSIFICADO,PRIVADO,RURAL,ABIERTA,MONOLINGUE,MATUTINA,DIARIO(REGULAR),HUEHUETENANGO
13-01-0158-46,13-004,HUEHUETENANGO,HUEHUETENANGO,COLEGIO PREUNIVERSITARIO CAMBRIDGE,1RA. CALLE ZONA 8,77649920,CLARA ARMIDA MORALES CASTILLO,ANA RENEɠMAURICIO DOM͎GUEZ,DIVERSIFICADO,PRIVADO,URBANA,ABIERTA,MONOLINGUE,MATUTINA,DIARIO(REGULAR),HUEHUETENANGO
13-01-0159-46,13-050,HUEHUETENANGO,HUEHUETENANGO,COLEGIO EVANGELICO MIXTO CHIMUSINIQUE,ALDEA CHIMUSINIQUE,77648506-45419234-41177068,REYNALDO RECINOS CASTILLO,MIRSA VIOLETA RECINOS ORDOхZ,DIVERSIFICADO,PRIVADO,RURAL,CERRADA TEMPORALMENTE,MONOLINGUE,NOCTURNA,DIARIO(REGULAR),HUEHUETENANGO
13-01-0162-46,13-050,HUEHUETENANGO,HUEHUETENANGO,COLEGIO EVANGELICO MIXTO CHIMUSINIQUE,ALDEA CHIMUSINIQUE,77648506-45419234-41177068,REYNALDO RECINOS CASTILLO,YASMINA MARGARITA RECINOS ORDOхZ,DIVERSIFICADO,PRIVADO,RURAL,CERRADA TEMPORALMENTE,MONOLINGUE,DOBLE,FIN DE SEMANA,HUEHUETENANGO
13-01-0163-46,13-050,HUEHUETENANGO,HUEHUETENANGO,COLEGIO EVANGELICO MIXTO CHIMUSINIQUE,ALDEA CHIMUSINIQUE,77648506-45419234-41177068,REYNALDO RECINOS CASTILLO,YASMINA MARGARITA RECINOS ORDOхZ,DIVERSIFICADO,PRIVADO,RURAL,CERRADA TEMPORALMENTE,MONOLINGUE,DOBLE,FIN DE SEMANA,HUEHUETENANGO
13-01-0166-46,13-050,HUEHUETENANGO,HUEHUETENANGO,COLEGIO TECNOLӇICO EN COMPUTACIӎ,2DA. CALLE 6-49 ZONA 1,77641301,REYNALDO RECINOS CASTILLO,LUIS FERNANDO GONZLEZ MAZARIEGOS,DIVERSIFICADO,PRIVADO,URBANA,CERRADA TEMPORALMENTE,MONOLINGUE,MATUTINA,DIARIO(REGULAR),HUEHUETENANGO
13-01-0171-46,13-004,HUEHUETENANGO,HUEHUETENANGO,LICEO PREUNIVERSITARIO DE INFORMATICA,4A AVENIDA 1-30 ZONA 1 DE LA CIUDAD,77648784,CLARA ARMIDA MORALES CASTILLO,NIVEA MARINA RIVAS GUTIɒREZ,DIVERSIFICADO,PRIVADO,URBANA,CERRADA TEMPORALMENTE,MONOLINGUE,DOBLE,FIN DE SEMANA,HUEHUETENANGO
13-01-0177-46,13-050,HUEHUETENANGO,HUEHUETENANGO,COLEGIO EVANGELICO MIXTO LA HERMOSA,SECTOR BRASILIA ZONA 7,77646365,REYNALDO RECINOS CASTILLO,MITZY MARTIELA CAMPOS GONZLEZ,DIVERSIFICADO,PRIVADO,URBANA,ABIERTA,MONOLINGUE,MATUTINA,DIARIO(REGULAR),HUEHUETENANGO
13-01-0178-46,13-050,HUEHUETENANGO,HUEHUETENANGO,COLEGIO IBEROAMERICANO DE HUEHUETENANGO,8VA. AVENIDA 1-80 ZONA 1,77681899,REYNALDO RECINOS CASTILLO,MIGUEL ANGEL PISQUIY QUIXTAN,DIVERSIFICADO,PRIVADO,URBANA,CERRADA TEMPORALMENTE,MONOLINGUE,VESPERTINA,DIARIO(REGULAR),HUEHUETENANGO
13-01-0179-46,13-050,HUEHUETENANGO,HUEHUETENANGO,COLEGIO IBEROAMERICANO DE HUEHUETENANGO,8VA. AVENIDA 1-80 ZONA 1,77681899,REYNALDO RECINOS CASTILLO,MIGUEL ANGEL PISQUIY QUIXTAN,DIVERSIFICADO,PRIVADO,URBANA,CERRADA TEMPORALMENTE,MONOLINGUE,DOBLE,FIN DE SEMANA,HUEHUETENANGO
13-01-0180-46,13-004,HUEHUETENANGO,HUEHUETENANGO,COLEGIO PRIVADO MIXTO AMERICANO,3A. AVENIDA 1-140 ZONA 3,77649739,CLARA ARMIDA MORALES CASTILLO,CHARLES STIV VASQUEZ GOMEZ,DIVERSIFICADO,PRIVADO,URBANA,CERRADA TEMPORALMENTE,MONOLINGUE,DOBLE,FIN DE SEMANA,HUEHUETENANGO
13-01-0181-46,13-050,HUEHUETENANGO,HUEHUETENANGO,CENTRO EDUCATIVO A DISTANCIA AULA VIRTUAL,"2A. CALLE 6-49, ZONA 1",77259211,REYNALDO RECINOS CASTILLO,OLIVER BOANERGES RECINOS RECINOS,DIVERSIFICADO,PRIVADO,URBANA,ABIERTA,MONOLINGUE,DOBLE,DIARIO(REGULAR),HUEHUETENANGO
13-01-0182-46,13-004,HUEHUETENANGO,HUEHUETENANGO,LICEO MIXTO SAN JOSE,CABECERA DEPARTAMENTAL,77690501,CLARA ARMIDA MORALES CASTILLO,FRANCISCO LEONEL HERNANDEZ GOMEZ,DIVERSIFICADO,PRIVADO,URBANA,CERRADA TEMPORALMENTE,MONOLINGUE,MATUTINA,DIARIO(REGULAR),HUEHUETENANGO
13-01-0183-46,13-004,HUEHUETENANGO,HUEHUETENANGO,LICEO MIXTO SAN JOSE,CABECERA DEPARTAMENTAL,77690501,CLARA ARMIDA MORALES CASTILLO,FRANCISCO LEONEL HERNANDEZ GOMEZ,DIVERSIFICADO,PRIVADO,URBANA,CERRADA TEMPORALMENTE,MONOLINGUE,DOBLE,DIARIO(REGULAR),HUEHUETENANGO
13-01-0193-46,13-004,HUEHUETENANGO,HUEHUETENANGO,COLEGIO PRIVADO MIXTO HERMANO PEDRO,ZACULEU CENTRAL ZONA 9,57699663,CLARA ARMIDA MORALES CASTILLO,RUDY ALEXIS CAJAS MARTINEZ,DIVERSIFICADO,PRIVADO,URBANA,CERRADA TEMPORALMENTE,MONOLINGUE,VESPERTINA,DIARIO(REGULAR),HUEHUETENANGO
13-01-0199-46,13-004,HUEHUETENANGO,HUEHUETENANGO,COLEGIO PRIVADO MIXTO EL DIVINO MAESTRO,ALDEA XINAXOJ,50486759,CLARA ARMIDA MORALES CASTILLO,ARGELIO DE JESړ LӐEZ VILLATORO,DIVERSIFICADO,PRIVADO,URBANA,CERRADA TEMPORALMENTE,MONOLINGUE,DOBLE,FIN DE SEMANA,HUEHUETENANGO
13-01-0200-46,13-004,HUEHUETENANGO,HUEHUETENANGO,COLEGIO PRIVADO MIXTO EL DIVINO MAESTRO,ALDEA XINAXOJ,50486759,CLARA ARMIDA MORALES CASTILLO,ARGELIO DE JESUS LOPEZ VILLATORO,DIVERSIFICADO,PRIVADO,RURAL,CERRADA TEMPORALMENTE,MONOLINGUE,VESPERTINA,DIARIO(REGULAR),HUEHUETENANGO
13-01-0214-46,13-050,HUEHUETENANGO,HUEHUETENANGO,"COLEGIO PREUNIVERSITARIO ""ALBERT EINSTEIN""",11 AVENIDA A 11-45 ZONA 8,79345932,REYNALDO RECINOS CASTILLO,SUSANA GUADALUPE ARREOLA DONIS,DIVERSIFICADO,PRIVADO,URBANA,CERRADA TEMPORALMENTE,MONOLINGUE,VESPERTINA,DIARIO(REGULAR),HUEHUETENANGO
13-01-0218-46,13-004,HUEHUETENANGO,HUEHUETENANGO,COLEGIO TECNOLOGICO DEL VALLE,"1A. CALLE 7-77, ZONA 8",77252793,CLARA ARMIDA MORALES CASTILLO,MARGARITA YAISMID PALACIOS CANO,DIVERSIFICADO,PRIVADO,URBANA,CERRADA TEMPORALMENTE,MONOLINGUE,DOBLE,FIN DE SEMANA,HUEHUETENANGO
13-01-0219-46,13-004,HUEHUETENANGO,HUEHUETENANGO,"LICEO PRIVADO MIXTO CRISTIANO ""PALABRA EN ACCION""","2A. CALLE FINAL 3-37 COLONIA ALVARADO, ZONA 5",77627179,CLARA ARMIDA MORALES CASTILLO,FEBE RAQUEL HERNNDEZ SUTUC,DIVERSIFICADO,PRIVADO,URBANA,ABIERTA,MONOLINGUE,MATUTINA,DIARIO(REGULAR),HUEHUETENANGO
13-01-0226-46,13-004,HUEHUETENANGO,HUEHUETENANGO,CENTRO EDUCATIVO MARRIOT,7A. CALLE 6-52 ZONA 1,77648219,CLARA ARMIDA MORALES CASTILLO,MARIO ARNOLDO HERNANDEZ LORENZO,DIVERSIFICADO,PRIVADO,URBANA,CERRADA TEMPORALMENTE,MONOLINGUE,DOBLE,FIN DE SEMANA,HUEHUETENANGO
13-01-0231-46,13-004,HUEHUETENANGO,HUEHUETENANGO,COLEGIO PREUNIVERSITARIO CAMBRIDGE,"1A. CALLE 7-77, ZONA 8",77251141,CLARA ARMIDA MORALES CASTILLO,DAVID ALFREDO ALVARADO GUTIɒREZ,DIVERSIFICADO,PRIVADO,URBANA,ABIERTA,MONOLINGUE,VESPERTINA,DIARIO(REGULAR),HUEHUETENANGO
13-01-0236-46,13-050,HUEHUETENANGO,HUEHUETENANGO,"CENTRO EDUCATIVO TECNOLӇICO ""SION""","7A. AVENIDA 6-55, ZONA 1",77648843,REYNALDO RECINOS CASTILLO,NORMA ARACELY REYES CASTRO,DIVERSIFICADO,PRIVADO,URBANA,CERRADA TEMPORALMENTE,MONOLINGUE,MATUTINA,DIARIO(REGULAR),HUEHUETENANGO
13-01-0237-46,13-004,HUEHUETENANGO,HUEHUETENANGO,CENTRO EDUCATIVO MARRIOT,7A. CALLE 6-52 ZONA 1,77648219,CLARA ARMIDA MORALES CASTILLO,MARIO ARNOLDO HERNANDEZ LORENZO,DIVERSIFICADO,PRIVADO,URBANA,CERRADA TEMPORALMENTE,MONOLINGUE,MATUTINA,DIARIO(REGULAR),HUEHUETENANGO
13-01-0238-46,13-004,HUEHUETENANGO,HUEHUETENANGO,CENTRO EDUCATIVO MARRIOT BRILLANTE,"5A. AVENIDA ""A"" 5-80 ZONA 1",77648219,CLARA ARMIDA MORALES CASTILLO,MARIO ARNOLDO HERNANDEZ LORENZO,DIVERSIFICADO,PRIVADO,URBANA,ABIERTA,MONOLINGUE,DOBLE,DIARIO(REGULAR),HUEHUETENANGO
13-01-0243-46,13-004,HUEHUETENANGO,HUEHUETENANGO,"COLEGIO PRIVADO MIXTO ""EL DIVINO MAESTRO""",ALDEA XINAXOJ,50486759,CLARA ARMIDA MORALES CASTILLO,ARGELIO DE JESړ LӐEZ VILLATORO,DIVERSIFICADO,PRIVADO,RURAL,ABIERTA,MONOLINGUE,DOBLE,FIN DE SEMANA,HUEHUETENANGO
13-01-0244-46,13-060,HUEHUETENANGO,HUEHUETENANGO,INSTITUTO TɃNICO DE CAPACITACIӎ Y PRODUCTIVIDAD INTECAP,3A. CALLE FINAL ZACULEU CENTRAL ZONA 9,79575353,AROLDO HOSBERI SOSA LӐEZ,EDGAR FERNANDO GRANADOS MɒIDA,DIVERSIFICADO,PRIVADO,URBANA,CERRADA TEMPORALMENTE,MONOLINGUE,DOBLE,DIARIO(REGULAR),HUEHUETENANGO
13-01-0246-46,13-004,HUEHUETENANGO,HUEHUETENANGO,LICEO CANADIENSE DEL NOR OCCIDENTE,"7A. CALLE 12-75, ZONA 5, COLONIA LA HONDONADA HUEHUETENANGO",77250964,CLARA ARMIDA MORALES CASTILLO,JULIO RENɠCALDERӎ FLORES,DIVERSIFICADO,PRIVADO,URBANA,CERRADA TEMPORALMENTE,MONOLINGUE,DOBLE,FIN DE SEMANA,HUEHUETENANGO
13-01-0268-46,13-004,HUEHUETENANGO,HUEHUETENANGO,LICEO PRIVADO DE CIENCIAS COMERCIALES,5A. AVENIDA 7-112 ZONA 1,77640126,CLARA ARMIDA MORALES CASTILLO,MARLIN MARIBEL HERNNDEZ CASTILLO,DIVERSIFICADO,PRIVADO,URBANA,CERRADA TEMPORALMENTE,MONOLINGUE,DOBLE,FIN DE SEMANA,HUEHUETENANGO
13-01-0269-46,13-004,HUEHUETENANGO,HUEHUETENANGO,COLEGIO TECNOLӇICO DEL VALLE,"1A. CALLE 7-77, ZONA 8",77252793,CLARA ARMIDA MORALES CASTILLO,ROSWIN JOSEF GӍEZ AGUSTIN,DIVERSIFICADO,PRIVADO,URBANA,ABIERTA,MONOLINGUE,DOBLE,FIN DE SEMANA,HUEHUETENANGO
13-01-0275-46,13-004,HUEHUETENANGO,HUEHUETENANGO,LICEO PRIVADO DE CIENCIAS COMERCIALES,5A. AVENIDA 7-112 ZONA 1,77640126,CLARA ARMIDA MORALES CASTILLO,MARLIN MARIBEL HERNNDEZ CASTILLO,DIVERSIFICADO,PRIVADO,URBANA,CERRADA TEMPORALMENTE,MONOLINGUE,DOBLE,FIN DE SEMANA,HUEHUETENANGO
13-01-0287-46,13-004,HUEHUETENANGO,HUEHUETENANGO,COLEGIO PREUNIVERSITARIO CAMBRIDGE,1RA. CALLE ZONA 8,77649920,CLARA ARMIDA MORALES CASTILLO,ANA RENEɠMAURICIO DOM͎GUEZ,DIVERSIFICADO,PRIVADO,URBANA,ABIERTA,MONOLINGUE,MATUTINA,DIARIO(REGULAR),HUEHUETENANGO
13-01-0288-46,13-004,HUEHUETENANGO,HUEHUETENANGO,LICEO PRIVADO DE CIENCIAS COMERCIALES,"5A. AVENIDA 7-112, ZONA 1",77640126,CLARA ARMIDA MORALES CASTILLO,MARLIN MARIBEL HERNNDEZ CASTILLO,DIVERSIFICADO,PRIVADO,URBANA,CERRADA TEMPORALMENTE,MONOLINGUE,MATUTINA,DIARIO(REGULAR),HUEHUETENANGO
13-01-0289-46,13-004,HUEHUETENANGO,HUEHUETENANGO,COLEGIO PRIVADO MIXTO AMERICANO,"3A. AVENIDA 1-140, ZONA 3",77649742,CLARA ARMIDA MORALES CASTILLO,JAIME LUIS LӐEZ MENDӚA,DIVERSIFICADO,PRIVADO,URBANA,ABIERTA,MONOLINGUE,MATUTINA,DIARIO(REGULAR),HUEHUETENANGO
13-01-0290-46,13-050,HUEHUETENANGO,HUEHUETENANGO,COLEGIO TECNOLӇICO DE HUEHUETENANGO,2A. AVENIDA 1-115 ZONA 3,77641301,REYNALDO RECINOS CASTILLO,OLIVER BOANERGES RECINOS RECINOS,DIVERSIFICADO,PRIVADO,URBANA,ABIERTA,MONOLINGUE,VESPERTINA,DIARIO(REGULAR),HUEHUETENANGO
13-01-0291-46,13-050,HUEHUETENANGO,HUEHUETENANGO,"COLEGIO PRIVADO MIXTO ""RAFAEL LANDIVAR""","5A. CALLE 11-66, ZONA 1",49664813,REYNALDO RECINOS CASTILLO,FLOR DE MARIA CASTILLO LӐEZ,DIVERSIFICADO,PRIVADO,URBANA,ABIERTA,MONOLINGUE,MATUTINA,DIARIO(REGULAR),HUEHUETENANGO
13-01-0292-46,13-050,HUEHUETENANGO,HUEHUETENANGO,"LICEO PRIVADO MIXTO ""CENTROAMERICANO HUEHUETECO""","5A. CALLE 11-65, ZONA 1",77646933,REYNALDO RECINOS CASTILLO,FLOR DE MARIA CASTILLO LӐEZ,DIVERSIFICADO,PRIVADO,URBANA,CERRADA TEMPORALMENTE,MONOLINGUE,DOBLE,FIN DE SEMANA,HUEHUETENANGO
13-01-0294-46,13-004,HUEHUETENANGO,HUEHUETENANGO,LICEO CANADIENSE DEL NOR OCCIDENTE,"7MA. CALLE 12-75, ZONA 5, COLONIA LA HONDONADA",77657888,CLARA ARMIDA MORALES CASTILLO,JULIO RENɠCALDERӎ FLORES,DIVERSIFICADO,PRIVADO,URBANA,CERRADA TEMPORALMENTE,MONOLINGUE,MATUTINA,DIARIO(REGULAR),HUEHUETENANGO
13-01-0295-46,13-050,HUEHUETENANGO,HUEHUETENANGO,COLEGIO TECNOLӇICO DE HUEHUETENANGO,2A. AVENIDA 1-115 ZONA 3,77259211,REYNALDO RECINOS CASTILLO,LUIS FERNANDO GONZLEZ MAZARIEGOS,DIVERSIFICADO,PRIVADO,URBANA,ABIERTA,MONOLINGUE,MATUTINA,DIARIO(REGULAR),HUEHUETENANGO
13-01-0302-46,13-004,HUEHUETENANGO,HUEHUETENANGO,LICEO PREUNIVERSITARIO DE INFORMTICA,"4A. AVENIDA 1-30, ZONA 1",77648784,CLARA ARMIDA MORALES CASTILLO,NIVEA MARINA RIVAS GUTIɒREZ,DIVERSIFICADO,PRIVADO,URBANA,ABIERTA,MONOLINGUE,VESPERTINA,DIARIO(REGULAR),HUEHUETENANGO
13-01-0304-46,13-050,HUEHUETENANGO,HUEHUETENANGO,"LICEO CRISTIANO MIXTO ""TIERRA FERTIL""","4TA. CALLE 2-66. ZONA 9, ZACULEU CENTRAL",79345726,REYNALDO RECINOS CASTILLO,CARLOS HUMBERTO GӍEZ ALVARADO,DIVERSIFICADO,PRIVADO,URBANA,CERRADA TEMPORALMENTE,MONOLINGUE,DOBLE,FIN DE SEMANA,HUEHUETENANGO
13-01-0306-46,13-004,HUEHUETENANGO,HUEHUETENANGO,COLEGIO REAL DE GUATEMALA,5A. AVENIDA FINAL ZONA 6,77640637,CLARA ARMIDA MORALES CASTILLO,LICDA. NORFELINA ARGENTINA PALACIOS,DIVERSIFICADO,PRIVADO,URBANA,CERRADA TEMPORALMENTE,MONOLINGUE,MATUTINA,DIARIO(REGULAR),HUEHUETENANGO
13-01-0309-46,13-004,HUEHUETENANGO,HUEHUETENANGO,CENTRO EDUCATIVO EL CEDRO,LA JOYA ZONA 4,77361257,CLARA ARMIDA MORALES CASTILLO,LUIS ALBERTO COBӎ VILLATORO,DIVERSIFICADO,PRIVADO,URBANA,CERRADA TEMPORALMENTE,MONOLINGUE,MATUTINA,DIARIO(REGULAR),HUEHUETENANGO
13-01-0313-46,13-004,HUEHUETENANGO,HUEHUETENANGO,COLEGIO EVANGɌICO MIXTO FILADELFIA,SEGUNDO CARRIZAL ZONA 3,77646971,CLARA ARMIDA MORALES CASTILLO,CARLOS RAڌ GӍEZ LӐEZ,DIVERSIFICADO,PRIVADO,RURAL,ABIERTA,MONOLINGUE,VESPERTINA,DIARIO(REGULAR),HUEHUETENANGO
13-01-0314-46,13-050,HUEHUETENANGO,HUEHUETENANGO,COLEGIO TECNOLӇICO DE HUEHUETENANGO,2A. AVENIDA 1-115 ZONA 3,77259211,REYNALDO RECINOS CASTILLO,OLIVER BOANERGES RECINOS RECINOS,DIVERSIFICADO,PRIVADO,URBANA,ABIERTA,MONOLINGUE,VESPERTINA,DIARIO(REGULAR),HUEHUETENANGO
13-01-0315-46,13-004,HUEHUETENANGO,HUEHUETENANGO,INSTITUTO TɃNICO DE CAPACITACIӎ Y PRODUCTIVIDAD INTECAP,"3A. CALLE FINAL, ZACULEU CENTRAL, ZONA 9",79575353,CLARA ARMIDA MORALES CASTILLO,FABIO GUILLERMO ZڑIGA SALGUERO,DIVERSIFICADO,PRIVADO,URBANA,ABIERTA,MONOLINGUE,DOBLE,DIARIO(REGULAR),HUEHUETENANGO
13-01-0318-46,13-004,HUEHUETENANGO,HUEHUETENANGO,"CENTRO EDUCATIVO PODER Y AUTOFORMACIӎ ""EXCELENCIA - CEPAGE""","6A. AVENIDA ""C"" 8-30 ZONA 1, COLONIA MAKEPEACE",77643494,CLARA ARMIDA MORALES CASTILLO,WALFRE RIGOBERTO MɒIDA ALVA,DIVERSIFICADO,PRIVADO,URBANA,CERRADA TEMPORALMENTE,MONOLINGUE,DOBLE,FIN DE SEMANA,HUEHUETENANGO
13-01-0322-46,13-004,HUEHUETENANGO,HUEHUETENANGO,CENTRO EDUCATIVO MARRIOT,"7A. CALLE 6-52, ZONA 1",77648219,CLARA ARMIDA MORALES CASTILLO,MARIO ARNOLDO HERNANDEZ LORENZO,DIVERSIFICADO,PRIVADO,URBANA,CERRADA TEMPORALMENTE,MONOLINGUE,DOBLE,FIN DE SEMANA,HUEHUETENANGO
13-01-0323-46,13-050,HUEHUETENANGO,HUEHUETENANGO,INSTITUTO NACIONAL DE EDUCACIӎ DIVERSIFICADA,9. CALLEJӎ B 12-94 ZONA 4 SECTOR LOS OLIVOS EL TERRERO,40124127,REYNALDO RECINOS CASTILLO,HUGO RUBɎ GӍEZ GӍEZ,DIVERSIFICADO,OFICIAL,RURAL,ABIERTA,MONOLINGUE,DOBLE,DIARIO(REGULAR),HUEHUETENANGO
13-01-0330-46,13-050,HUEHUETENANGO,HUEHUETENANGO,"LICEO CRISTIANO ""NUEVOS HORIZONTES""","CALZADA KAIBIL BALAM, CANTӎ SAN JOSɬ ZONA 5",57621120,REYNALDO RECINOS CASTILLO,MATEO GӍEZ Y GӍEZ,DIVERSIFICADO,PRIVADO,URBANA,CERRADA TEMPORALMENTE,MONOLINGUE,DOBLE,FIN DE SEMANA,HUEHUETENANGO
13-01-0335-46,13-004,HUEHUETENANGO,HUEHUETENANGO,"COLEGIO DE EDUCACIӎ Y DESARROLLO INTEGRAL ""XETENAM""",ALDEA OJECHEJEL,47853737,CLARA ARMIDA MORALES CASTILLO,INGRID LINETT MENDӚA RODRIGUEZ,DIVERSIFICADO,PRIVADO,RURAL,ABIERTA,MONOLINGUE,DOBLE,FIN DE SEMANA,HUEHUETENANGO
13-01-0337-46,13-004,HUEHUETENANGO,HUEHUETENANGO,COLEGIO PREUNIVERSITARIO LICEO GUATEMALA,2A. CALLE 7-32 ZONA 1,47854928,CLARA ARMIDA MORALES CASTILLO,CLAUDIA JEANNETTE PALACIOS HERNNDEZ,DIVERSIFICADO,PRIVADO,URBANA,ABIERTA,MONOLINGUE,MATUTINA,DIARIO(REGULAR),HUEHUETENANGO
13-01-0340-46,13-004,HUEHUETENANGO,HUEHUETENANGO,COLEGIO PRIVADO MIXTO AMERICANO,"3A. AVENIDA 1-140, ZONA 3",77649742,CLARA ARMIDA MORALES CASTILLO,JAIME LUIS LӐEZ MENDӚA,DIVERSIFICADO,PRIVADO,URBANA,ABIERTA,MONOLINGUE,DOBLE,DIARIO(REGULAR),HUEHUETENANGO
13-01-0341-46,13-004,HUEHUETENANGO,HUEHUETENANGO,LICEO PRIVADO DE CIENCIAS COMERCIALES,"5A. AVENIDA 7-112, ZONA 1",77640126,CLARA ARMIDA MORALES CASTILLO,MARLIN MARIBEL HERNNDEZ CASTILLO,DIVERSIFICADO,PRIVADO,URBANA,ABIERTA,MONOLINGUE,DOBLE,FIN DE SEMANA,HUEHUETENANGO
13-01-0342-46,13-004,HUEHUETENANGO,HUEHUETENANGO,INSTITUTO NACIONAL DE EDUCACIӎ DIVERSIFICADA,ALDEA ZACULEU CENTRAL ZONA 9,30912815,CLARA ARMIDA MORALES CASTILLO,MAYRA LISETH PAR AZURDIA,DIVERSIFICADO,OFICIAL,RURAL,ABIERTA,MONOLINGUE,MATUTINA,DIARIO(REGULAR),HUEHUETENANGO
13-01-0346-46,13-060,HUEHUETENANGO,HUEHUETENANGO,CENTRO DE EDUCACIӎ EXTRAESCOLAR CEEX,1RA. CALLE ZONA 8 HUEHUETENANGO,32134222,AROLDO HOSBERI SOSA LӐEZ,IRENE ROCIO FABIAN AGUSTIN,DIVERSIFICADO,PRIVADO,URBANA,ABIERTA,MONOLINGUE,DOBLE,INTERCALADO,HUEHUETENANGO
13-01-0348-46,13-004,HUEHUETENANGO,HUEHUETENANGO,"CENTRO EDUCATIVO MARRIOT ""BRILLANTE""","7A. CALLE 6-52 ""A"", ZONA 1",77648219,CLARA ARMIDA MORALES CASTILLO,MARIO ARNOLDO HERNANDEZ LORENZO,DIVERSIFICADO,PRIVADO,RURAL,CERRADA TEMPORALMENTE,MONOLINGUE,DOBLE,FIN DE SEMANA,HUEHUETENANGO
13-01-0349-46,13-004,HUEHUETENANGO,HUEHUETENANGO,LICEO EVANGɌICO EL ALBA,"6A. AVENIDA ""A"" 9-17, ZONA 1",77682352,CLARA ARMIDA MORALES CASTILLO,JOSɠRAڌ MART͎EZ XUTUC,DIVERSIFICADO,PRIVADO,URBANA,ABIERTA,MONOLINGUE,MATUTINA,DIARIO(REGULAR),HUEHUETENANGO
13-01-0350-46,13-050,HUEHUETENANGO,HUEHUETENANGO,COLEGIO MIXTO ASTURIAS,"7A. AVENIDA ""B"" 1-26 ZONA 1",77640625,REYNALDO RECINOS CASTILLO,WALTER EDUARDO MART͎EZ GӍEZ,DIVERSIFICADO,PRIVADO,URBANA,CERRADA TEMPORALMENTE,MONOLINGUE,DOBLE,DIARIO(REGULAR),HUEHUETENANGO
13-01-0352-46,13-050,HUEHUETENANGO,HUEHUETENANGO,INSTITUTO NACIONAL DE EDUCACIӎ DIVERSIFICADA,ALDEA TOJOTZALɬ PUENTE ARROYO,53806348,REYNALDO RECINOS CASTILLO,JESړ MANUEL LӐEZ HERRERA,DIVERSIFICADO,OFICIAL,RURAL,ABIERTA,MONOLINGUE,VESPERTINA,DIARIO(REGULAR),HUEHUETENANGO
13-01-0354-46,13-004,HUEHUETENANGO,HUEHUETENANGO,COLEGIO MIXTO PRӃERES PLUS FIN DE SEMANA,2A. AVENIDA 4-04 ZONA 3,77627415,CLARA ARMIDA MORALES CASTILLO,CARLOS NOVEL GUTIɒREZ MORALES,DIVERSIFICADO,PRIVADO,URBANA,ABIERTA,MONOLINGUE,DOBLE,FIN DE SEMANA,HUEHUETENANGO
13-01-0355-46,13-004,HUEHUETENANGO,HUEHUETENANGO,COLEGIO MIXTO PRӃERES PLUS FIN DE SEMANA,2A. AVENIDA 4-04 ZONA 3,77627415,CLARA ARMIDA MORALES CASTILLO,CARLOS NOVEL GUTIɒREZ MORALES,DIVERSIFICADO,PRIVADO,URBANA,CERRADA TEMPORALMENTE,MONOLINGUE,DOBLE,FIN DE SEMANA,HUEHUETENANGO
13-01-0358-46,13-004,HUEHUETENANGO,HUEHUETENANGO,"LICEO PRIVADO MIXTO ""DAME""",3ERA. CALLE FINAL ZONA 8,77642550,CLARA ARMIDA MORALES CASTILLO,OSMAN DAVID ANGEL ORTIZ,DIVERSIFICADO,PRIVADO,URBANA,ABIERTA,MONOLINGUE,MATUTINA,DIARIO(REGULAR),HUEHUETENANGO
13-01-0360-46,13-050,HUEHUETENANGO,HUEHUETENANGO,"LICEO CRISTIANO MIXTO ""TIERRA FERTIL""",4TA CALLE 2-66 ZONA 9 ZACULEU CENTRAL,79345726,REYNALDO RECINOS CASTILLO,CARLOS HUMBERTO GӍEZ ALVARADO,DIVERSIFICADO,PRIVADO,URBANA,CERRADA TEMPORALMENTE,MONOLINGUE,VESPERTINA,DIARIO(REGULAR),HUEHUETENANGO
13-01-0361-46,13-050,HUEHUETENANGO,HUEHUETENANGO,"LICEO CRISTIANO MIXTO ""TIERRA FɒTIL""",4TA CALLE 2-66 ZONA 9 ZACULEU CENTRAL,79345726,REYNALDO RECINOS CASTILLO,CARLOS HUMBERTO GӍEZ ALVARADO,DIVERSIFICADO,PRIVADO,URBANA,ABIERTA,MONOLINGUE,MATUTINA,DIARIO(REGULAR),HUEHUETENANGO
13-01-0363-46,13-004,HUEHUETENANGO,HUEHUETENANGO,COLEGIO DE EDUCACIӎ Y DESARROLLO INTEGRAL XETENAM,ALDEA OJECHEJEL,47853737,CLARA ARMIDA MORALES CASTILLO,INGRID LINETT MENDӚA RODRIGUEZ,DIVERSIFICADO,PRIVADO,RURAL,ABIERTA,MONOLINGUE,MATUTINA,DIARIO(REGULAR),HUEHUETENANGO
13-01-0366-46,13-004,HUEHUETENANGO,HUEHUETENANGO,COLEGIO INTEGRAL FORMATIVO ROBLES,"2A. AVENIDA A 1-15, ZONA 3",77649950,CLARA ARMIDA MORALES CASTILLO,NOɠISÁS GALINDO HERNNDEZ,DIVERSIFICADO,PRIVADO,URBANA,ABIERTA,MONOLINGUE,VESPERTINA,DIARIO(REGULAR),HUEHUETENANGO
13-01-0368-46,13-004,HUEHUETENANGO,HUEHUETENANGO,CENTRO EDUCATIVO MARRIOT BRILLANTE,"7A. CALLE 6-52- ""A"" ZONA 1",77648219,CLARA ARMIDA MORALES CASTILLO,MARIO ARNOLDO HERNANDEZ LORENZO,DIVERSIFICADO,PRIVADO,URBANA,ABIERTA,MONOLINGUE,DOBLE,FIN DE SEMANA,HUEHUETENANGO
13-01-0369-46,13-004,HUEHUETENANGO,HUEHUETENANGO,CENTRO EDUCATIVO MARRIOT BRILLANTE,"5A. AVENIDA ""A"" 5-80 ZONA 1",77648219,CLARA ARMIDA MORALES CASTILLO,MARIO ARNOLDO HERNANDEZ LORENZO,DIVERSIFICADO,PRIVADO,URBANA,ABIERTA,MONOLINGUE,MATUTINA,DIARIO(REGULAR),HUEHUETENANGO
13-01-0372-46,13-050,HUEHUETENANGO,HUEHUETENANGO,COLEGIO INTEGRAL FORMATIVO ROBLES DE HUEHUETENANGO,"2DA. AV. ""A"" 1-15, ZONA 3, EL CALVARIO",77649950,REYNALDO RECINOS CASTILLO,NOɠISAIAS GALINDO HERNNDEZ,DIVERSIFICADO,PRIVADO,URBANA,ABIERTA,MONOLINGUE,VESPERTINA,DIARIO(REGULAR),HUEHUETENANGO
13-01-0373-46,13-004,HUEHUETENANGO,HUEHUETENANGO,COLEGIO TɃNICO PROFESIONAL DE OCCIDENTE,3. AVENIDA FINAL ZONA 3,58919204,CLARA ARMIDA MORALES CASTILLO,OSCAR ROMEOVILLATORO GӍEZ,DIVERSIFICADO,PRIVADO,URBANA,CERRADA TEMPORALMENTE,MONOLINGUE,MATUTINA,DIARIO(REGULAR),HUEHUETENANGO
13-01-0375-46,13-004,HUEHUETENANGO,HUEHUETENANGO,"COLEGIO CATӌICO ""LA INMACULADA CONCEPCIӎ""",1A. CALLE ZONA 3 EL CALVARIO,77649650,CLARA ARMIDA MORALES CASTILLO,ERICA ARACELY MART͎EZ CASTILLO,DIVERSIFICADO,PRIVADO,URBANA,ABIERTA,MONOLINGUE,MATUTINA,DIARIO(REGULAR),HUEHUETENANGO
13-01-0376-46,13-050,HUEHUETENANGO,HUEHUETENANGO,COLEGIO REAL AMERICANO,7A. CALLE 12-75 ZONA 5 COLONIA LA HONDONADA,77252085,REYNALDO RECINOS CASTILLO,ANA KARINA GORDILLO ALVARADO,DIVERSIFICADO,PRIVADO,URBANA,ABIERTA,MONOLINGUE,VESPERTINA,DIARIO(REGULAR),HUEHUETENANGO
13-01-0379-46,13-060,HUEHUETENANGO,HUEHUETENANGO,"PROGRAMA NACIONAL DE EDUCACIӎ ALTERNATIVA, PRONEA",5A. AVENIDA 9-98 ZONA 7 SECTOR BRASILIA,47931173,AROLDO HOSBERI SOSA LӐEZ,SANTOS RUYN CHAMALɼ/td>,DIVERSIFICADO,OFICIAL,URBANA,ABIERTA,MONOLINGUE,DOBLE,A DISTANCIA,HUEHUETENANGO
13-01-0381-46,13-060,HUEHUETENANGO,HUEHUETENANGO,CENTRO DE EDUCACIӎ EXTRAESCOLAR -CEEX- DEPARTAMENTAL,"5A. AVENIDA 9-98, ZONA 7, SECTOR BRASILIA",45766461,AROLDO HOSBERI SOSA LӐEZ,ROSAL͏ BENJAM͎ AGUILAR MORALES,DIVERSIFICADO,OFICIAL,URBANA,ABIERTA,MONOLINGUE,DOBLE,SEMIPRESENCIAL,HUEHUETENANGO
13-01-0382-46,13-004,HUEHUETENANGO,HUEHUETENANGO,INSTITUTO NACIONAL DE EDUCACIӎ DIVERSIFICADA,ALDEA SUCULQUE,57410796,CLARA ARMIDA MORALES CASTILLO,WILLIAM ENRIQUE CALDERӎ AVILA,DIVERSIFICADO,OFICIAL,RURAL,ABIERTA,MONOLINGUE,VESPERTINA,DIARIO(REGULAR),HUEHUETENANGO
13-01-0385-46,13-050,HUEHUETENANGO,HUEHUETENANGO,INSTITUTO NACIONAL DE EDUCACIӎ DIVERSIFICADA,"SECTOR LOS OLIVOS, ZONA 4 02/01/2023",50518236,REYNALDO RECINOS CASTILLO,HUGO RUBɎ GӍEZ GӍEZ,DIVERSIFICADO,OFICIAL,RURAL,CERRADA TEMPORALMENTE,MONOLINGUE,DOBLE,FIN DE SEMANA,HUEHUETENANGO
13-01-0386-46,13-050,HUEHUETENANGO,HUEHUETENANGO,INSTITUTO NACIONAL DE EDUCACIӎ DIVERSIFICADA,"9. CALLEJӎ B 12-94, ZONA 4, SECTOR LOS OLIVOS EL TERRERO",31098005,REYNALDO RECINOS CASTILLO,ROXANA FABIOLA PALACIOS FɌIX,DIVERSIFICADO,OFICIAL,RURAL,ABIERTA,MONOLINGUE,SIN JORNADA,SEMIPRESENCIAL (DOS D́S A LA SEMANA),HUEHUETENANGO
13-01-0388-46,13-050,HUEHUETENANGO,HUEHUETENANGO,"CENTRO EDUCATIVO A DISTANCIA ""AULA VIRTUAL""","2A. AVENIDA 1-115, ZONA 3",77259211,REYNALDO RECINOS CASTILLO,OLIVER BOANERGES RECINOS RECINOS,DIVERSIFICADO,PRIVADO,URBANA,ABIERTA,MONOLINGUE,SIN JORNADA,A DISTANCIA,HUEHUETENANGO
