CODIGO,DISTRITO,DEPARTAMENTO,MUNICIPIO,ESTABLECIMIENTO,DIRECCION,TELEFONO,SUPERVISOR,DIRECTOR,NIVEL,SECTOR,AREA,STATUS,MODALIDAD,JORNADA,PLAN,DEPARTAMENTAL
13-03-0048-46,13-010,HUEHUETENANGO,MALACATANCITO,COLEGIO MIXTO INTERCULTURAL MALACATANCITO,CABECERA MUNICIPAL,57720727,AUGUSTO RENɠCASTILLO AGUIRRE,JUAN ALONZO RAMOS RAMOS,DIVERSIFICADO,PRIVADO,URBANA,CERRADA TEMPORALMENTE,MONOLINGUE,DOBLE,FIN DE SEMANA,HUEHUETENANGO
13-03-0049-46,13-010,HUEHUETENANGO,MALACATANCITO,COLEGIO MIXTO INTERCULTURAL MALACATANCITO,CABECERA MUNICIPAL,57720727,AUGUSTO RENɠCASTILLO AGUIRRE,JUAN ALONZO RAMOS RAMOS,DIVERSIFICADO,PRIVADO,URBANA,ABIERTA,MONOLINGUE,VESPERTINA,DIARIO(REGULAR),HUEHUETENANGO
13-03-0050-46,13-010,HUEHUETENANGO,MALACATANCITO,COLEGIO MIXTO INTERCULTURAL MALACATANCITO,CABECERA MUNICIPAL,57720727,AUGUSTO RENɠCASTILLO AGUIRRE,JUAN ALONZO RAMOS RAMOS,DIVERSIFICADO,PRIVADO,URBANA,ABIERTA,MONOLINGUE,DOBLE,FIN DE SEMANA,HUEHUETENANGO
13-03-0051-46,13-010,HUEHUETENANGO,MALACATANCITO,"LICEO CATӌICO MIXTO ""SAGRADO CORAZӎ DE JESړ""","CALZADA FɌIX CALDERӎ AVILA 0-15, ZONA 6, BARRIO LA COMUNIDAD",77569558,AUGUSTO RENɠCASTILLO AGUIRRE,TOMASA ZACAŔS DOMINGO,DIVERSIFICADO,PRIVADO,URBANA,CERRADA TEMPORALMENTE,MONOLINGUE,MATUTINA,DIARIO(REGULAR),HUEHUETENANGO
13-03-0055-46,13-009,HUEHUETENANGO,MALACATANCITO,ASOCIACION DE MAESTROS DE EDUCACION RURAL DE GUATEMALA -AMERG-,ALDEA XEPON CHIQUITO,53013050,AUGUSTO RENɠCASTILLO AGUIRRE,PABLO TAYUN SONTAY,DIVERSIFICADO,PRIVADO,RURAL,CERRADA TEMPORALMENTE,MONOLINGUE,DOBLE,FIN DE SEMANA,HUEHUETENANGO
13-03-0059-46,13-009,HUEHUETENANGO,MALACATANCITO,ASOCIACIӎ DE MAESTROS DE EDUCACIӎ RURAL DE GUATEMALA -AMERG-,XEPON CHIQUITO,40659542,AUGUSTO RENɠCASTILLO AGUIRRE,PABLO TAYڎ SONTAY,DIVERSIFICADO,PRIVADO,RURAL,CERRADA TEMPORALMENTE,MONOLINGUE,VESPERTINA,DIARIO(REGULAR),HUEHUETENANGO
13-03-0060-46,13-010,HUEHUETENANGO,MALACATANCITO,COLEGIO PARROQUIAL MIXTO SANTA ANA,"CALZADA FɌIX CALDERӎ AVILA 0-15, ZONA 6 BARRIO LA COMUNIDAD",77569558,AUGUSTO RENɠCASTILLO AGUIRRE,TOMASA ZACAŔS DOMINGO,DIVERSIFICADO,PRIVADO,URBANA,ABIERTA,MONOLINGUE,MATUTINA,DIARIO(REGULAR),HUEHUETENANGO
13-03-0064-46,13-010,HUEHUETENANGO,MALACATANCITO,INSTITUTO MUNICIPAL DE EDUCACIӎ DIVERSIFICADA NOCTURNA,BARRIO SAN JOAQU͎,50073799,AUGUSTO RENɠCASTILLO AGUIRRE,DAVID GERARDO ALFARO,DIVERSIFICADO,MUNICIPAL,URBANA,CERRADA TEMPORALMENTE,MONOLINGUE,NOCTURNA,DIARIO(REGULAR),HUEHUETENANGO
13-03-0065-46,13-010,HUEHUETENANGO,MALACATANCITO,"LICEO PRIVADO MIXTO ""EMANUEL""",CABECERA MUNICIPAL,50054877,AUGUSTO RENɠCASTILLO AGUIRRE,SAIRO BACILIO VILLATORO VSQUEZ,DIVERSIFICADO,PRIVADO,URBANA,ABIERTA,MONOLINGUE,VESPERTINA,DIARIO(REGULAR),HUEHUETENANGO
13-03-0067-46,13-010,HUEHUETENANGO,MALACATANCITO,"LICEO PRIVADO MIXTO ""EMANUEL""",CABECERA MUNICIPAL,50054877,AUGUSTO RENɠCASTILLO AGUIRRE,SAIRO BACILIO VILLATORO VSQUEZ,DIVERSIFICADO,PRIVADO,URBANA,ABIERTA,MONOLINGUE,DOBLE,FIN DE SEMANA,HUEHUETENANGO
13-03-0068-46,13-010,HUEHUETENANGO,MALACATANCITO,"LICEO PRIVADO MIXTO ""EMANUEL""",CABECERA MUNICIPAL,50054877,AUGUSTO RENɠCASTILLO AGUIRRE,SAIRO BACILIO VILLATORO VSQUEZ,DIVERSIFICADO,PRIVADO,URBANA,CERRADA TEMPORALMENTE,MONOLINGUE,DOBLE,FIN DE SEMANA,HUEHUETENANGO
13-03-0069-46,13-010,HUEHUETENANGO,MALACATANCITO,COLEGIO TECNOLӇICO RURAL,CASER͏ TOJOCHN,53322650,AUGUSTO RENɠCASTILLO AGUIRRE,MICHAEL AROLDO RODR͇UEZ LӐEZ,DIVERSIFICADO,PRIVADO,RURAL,ABIERTA,MONOLINGUE,DOBLE,FIN DE SEMANA,HUEHUETENANGO
13-03-0070-46,13-010,HUEHUETENANGO,MALACATANCITO,COLEGIO TECNOLӇICO RURAL,"CASER͏ TOJOCHN, ALDEA PUCAL",53226509,AUGUSTO RENɠCASTILLO AGUIRRE,MICHAEL AROLDO RODR͇UEZ LӐEZ,DIVERSIFICADO,PRIVADO,RURAL,ABIERTA,MONOLINGUE,MATUTINA,DIARIO(REGULAR),HUEHUETENANGO
13-03-0076-46,13-010,HUEHUETENANGO,MALACATANCITO,LICEO PRIVADO MIXTO EMANUEL,CABECERA MUNICIPAL DE MALACATANCITO MALACATANCITO,50054877,AUGUSTO RENɠCASTILLO AGUIRRE,FLAVIO ARTURO SAMAYOA RAMOS,DIVERSIFICADO,PRIVADO,URBANA,ABIERTA,MONOLINGUE,DOBLE,DIARIO(REGULAR),HUEHUETENANGO
13-03-0080-46,13-010,HUEHUETENANGO,MALACATANCITO,LICEO PRIVADO MIXTO EMANUEL,CABECERA MUNICIPAL,50054877,AUGUSTO RENɠCASTILLO AGUIRRE,SAIRO BACILIO VILLATORO VSQUEZ,DIVERSIFICADO,PRIVADO,URBANA,ABIERTA,MONOLINGUE,SIN JORNADA,SEMIPRESENCIAL (UN D́ A LA SEMANA),HUEHUETENANGO
13-03-0083-46,13-009,HUEHUETENANGO,MALACATANCITO,COLEGIO MIXTO INTERCULTURAL MALACATANCITO,CABECERA MUNICIPAL,77569712,AUGUSTO RENɠCASTILLO AGUIRRE,JUAN ALONZO RAMOS RAMOS,DIVERSIFICADO,PRIVADO,URBANA,ABIERTA,MONOLINGUE,SIN JORNADA,SEMIPRESENCIAL (UN D́ A LA SEMANA),HUEHUETENANGO
13-03-0084-46,13-010,HUEHUETENANGO,MALACATANCITO,COLEGIO PRIVADO MIXTO TECNOLӇICO RURAL,CASER͏ TOJOCHN,53226509,AUGUSTO RENɠCASTILLO AGUIRRE,MICHAEL AROLDO RODR͇UEZ LӐEZ,DIVERSIFICADO,PRIVADO,RURAL,ABIERTA,MONOLINGUE,SIN JORNADA,SEMIPRESENCIAL (UN D́ A LA SEMANA),HUEHUETENANGO
13-04-0070-46,13-012,HUEHUETENANGO,CUILCO,INSTITUTO NACIONAL DE EDUCACION DIVERSIFICADA,ALDEA YERBA BUENA ALTA,44949669,LUIS FERNANDO VENTURA GONZLEZ,BENIGNO ODILIO GONZLEZ VELSQUEZ,DIVERSIFICADO,OFICIAL,RURAL,CERRADA TEMPORALMENTE,MONOLINGUE,VESPERTINA,DIARIO(REGULAR),HUEHUETENANGO
13-04-0091-46,13-011,HUEHUETENANGO,CUILCO,INSTITUTO DE NIVEL DIVERSIFICADO POR COOPERATIVA,"CASER͏ EL CARRIZAL, ALDEA EL TRIUNFO",40401004,DELMY ELISAMA CHAVEZ ROBLERO,JOSɠMARIANO GALINDO HERRERA,DIVERSIFICADO,COOPERATIVA,RURAL,CERRADA TEMPORALMENTE,MONOLINGUE,VESPERTINA,DIARIO(REGULAR),HUEHUETENANGO
13-04-0098-46,13-011,HUEHUETENANGO,CUILCO,INSTITUTO DE EDUCACIӎ DIVERSIFICADA POR COOPERATIVA,ALDEA POSONICAPA CHIQUITO,51894002,DELMY ELISAMA CHAVEZ ROBLERO,NIKER LUCIANO CIFUENTES GLVEZ,DIVERSIFICADO,COOPERATIVA,RURAL,ABIERTA,MONOLINGUE,VESPERTINA,DIARIO(REGULAR),HUEHUETENANGO
13-04-0108-46,13-060,HUEHUETENANGO,CUILCO,CENTRO DE EDUCACIӎ EXTRAESCOLAR CEEX,CABECERA MUNICIPAL,30791840,AROLDO HOSBERI SOSA LӐEZ,KARINA ARNI GLVEZ CAMAS,DIVERSIFICADO,PRIVADO,URBANA,CERRADA TEMPORALMENTE,MONOLINGUE,DOBLE,DIARIO(REGULAR),HUEHUETENANGO
13-04-0112-46,13-012,HUEHUETENANGO,CUILCO,INSTITUTO NACIONAL DE EDUCACION DIVERSIFICADA,CASER͏ LA CRUZ REGIONAL,37553837,LUIS FERNANDO VENTURA GONZLEZ,BENIGNO ODILIO GONZLEZ VELSQUEZ,DIVERSIFICADO,OFICIAL,RURAL,ABIERTA,MONOLINGUE,VESPERTINA,DIARIO(REGULAR),HUEHUETENANGO
13-04-0116-46,13-012,HUEHUETENANGO,CUILCO,"INSTITUTO PRIVADO MIXTO ""I.P.E.V.""",ALDEA SOSͼ/td>,49585878,LUIS FERNANDO VENTURA GONZLEZ,ELIO ENA͠HERNNDEZ MART͎EZ,DIVERSIFICADO,PRIVADO,RURAL,ABIERTA,MONOLINGUE,MATUTINA,A DISTANCIA,HUEHUETENANGO
13-04-0117-46,13-012,HUEHUETENANGO,CUILCO,"INSTITUTO PRIVADO MIXTO ""I.P.E.V.""",ALDEA SOSͼ/td>,49585878,LUIS FERNANDO VENTURA GONZLEZ,ELIO ENA͠HERNNDEZ MART͎EZ,DIVERSIFICADO,PRIVADO,RURAL,ABIERTA,MONOLINGUE,DOBLE,A DISTANCIA,HUEHUETENANGO
13-04-0118-46,13-060,HUEHUETENANGO,CUILCO,CENTRO DE EDUCACIӎ EXTRAESCOLAR MUNICIPAL-CEEXM,16/10/21,45766136,AROLDO HOSBERI SOSA LӐEZ,BERNABɠPATROCINIO GLVEZ ROBLERO,DIVERSIFICADO,PRIVADO,URBANA,ABIERTA,MONOLINGUE,DOBLE,SEMIPRESENCIAL,HUEHUETENANGO
13-04-0119-46,13-013,HUEHUETENANGO,CUILCO,COLEGIO INTEGRAL EMPRESARIAL POR MADUREZ- CIEM,CALLE LA PAZ,77619224,JOSɠDAVID VELSQUEZ ANGEL,HELEN MARLENY LӐEZ ESTRADA,DIVERSIFICADO,PRIVADO,URBANA,ABIERTA,MONOLINGUE,SIN JORNADA,SEMIPRESENCIAL (UN D́ A LA SEMANA),HUEHUETENANGO
13-04-6414-46,13-012,HUEHUETENANGO,CUILCO,INSTITUTO NORMAL MIXTO PRIVADO SAN ANDRES,CABECERA MUNICIPAL,49771646,LUIS FERNANDO VENTURA GONZLEZ,JESړ CATALINO HERRERA DE LEӎ,DIVERSIFICADO,PRIVADO,URBANA,ABIERTA,MONOLINGUE,VESPERTINA,DIARIO(REGULAR),HUEHUETENANGO
13-04-6751-46,13-011,HUEHUETENANGO,CUILCO,COLEGIO PRIVADO MIXTO PERLA ESCONDIDA,CABECERA MUNICIPAL,30846812,DELMY ELISAMA CHAVEZ ROBLERO,GEREMIAS GLVEZ MAZARIEGOS,DIVERSIFICADO,PRIVADO,URBANA,ABIERTA,MONOLINGUE,VESPERTINA,DIARIO(REGULAR),HUEHUETENANGO
13-04-7117-46,13-052,HUEHUETENANGO,CUILCO,COLEGIO INTEGRAL EMPRESARIAL CUILQUENSE POR MADUREZ,CABECERA MUNICIPAL,77619224,CLAUDIA HERMENCIA VILLATORO RODR͇UEZ DE CHAN,HELEN MARLENY LӐEZ ESTRADA,DIVERSIFICADO,PRIVADO,URBANA,CERRADA TEMPORALMENTE,MONOLINGUE,DOBLE,FIN DE SEMANA,HUEHUETENANGO
13-04-7122-46,13-011,HUEHUETENANGO,CUILCO,COLEGIO PRIVADO MIXTO JOSE ERNESTO MONZON,,,DELMY ELISAMA CHAVEZ ROBLERO,,DIVERSIFICADO,PRIVADO,URBANA,CERRADA TEMPORALMENTE,MONOLINGUE,DOBLE,FIN DE SEMANA,HUEHUETENANGO
13-04-7123-46,13-011,HUEHUETENANGO,CUILCO,COLEGIO PRIVADO MIXTO JOSE ERNESTO MONZON,CABECERA MUNICIPAL,57234249,DELMY ELISAMA CHAVEZ ROBLERO,SONIA NATIVIDAD MORENO MɒIDA,DIVERSIFICADO,PRIVADO,URBANA,CERRADA TEMPORALMENTE,MONOLINGUE,DOBLE,FIN DE SEMANA,HUEHUETENANGO
13-05-0027-46,13-014,HUEHUETENANGO,NENTON,COLEGIO PARROQUIAL PRIVADO MIXTO NUESTRO SEяR DE ESQUIPULAS,CABECERA MUNICIPAL,,JOSELINO SAMAYOA CASTILLO,ISMAEL EUGENIO PASCUAL GUILLɎ,DIVERSIFICADO,PRIVADO,URBANA,ABIERTA,MONOLINGUE,VESPERTINA,DIARIO(REGULAR),HUEHUETENANGO
13-05-0035-46,13-014,HUEHUETENANGO,NENTON,COLEGIO PRIVADO MIXTO NENTONENSE,NENTON,50327661,JOSELINO SAMAYOA CASTILLO,ELVIN ABILIO LӐEZ GRANADOS,DIVERSIFICADO,PRIVADO,URBANA,CERRADA TEMPORALMENTE,MONOLINGUE,DOBLE,FIN DE SEMANA,HUEHUETENANGO
13-05-0041-46,13-014,HUEHUETENANGO,NENTON,"COLEGIO EVANGɌICO MIXTO ""LA VID VERDADERA""",CABECERA MUNICIPAL,77800398,JOSELINO SAMAYOA CASTILLO,NILSAN SAYDETH MONTEJO MENDOZA,DIVERSIFICADO,PRIVADO,URBANA,ABIERTA,MONOLINGUE,VESPERTINA,DIARIO(REGULAR),HUEHUETENANGO
13-05-0043-46,13-015,HUEHUETENANGO,NENTON,COLEGIO MIXTO CHACULENSE CONNIE VANDERHYDEN,"COLONIA NUEVA ESPERANZA, CHACUL|/td>",51923824,BRENDY SINDENY AGUILAR RIVAS,MARIO ROLANDO MONTEJO LӐEZ,DIVERSIFICADO,PRIVADO,RURAL,CERRADA TEMPORALMENTE,BILINGUE,VESPERTINA,DIARIO(REGULAR),HUEHUETENANGO
13-05-0044-46,13-014,HUEHUETENANGO,NENTON,"COLEGIO PRIVADO MIXTO ""NENTONENSE""",CABECERA MUNICIPAL,50327661,JOSELINO SAMAYOA CASTILLO,ELVIN ABILIO LӐEZ GRANADOS,DIVERSIFICADO,PRIVADO,URBANA,ABIERTA,MONOLINGUE,VESPERTINA,DIARIO(REGULAR),HUEHUETENANGO
13-05-0052-46,13-014,HUEHUETENANGO,NENTON,"COLEGIO INTERCULTURAL PRIVADO MIXTO ""CIENCIA APLICADA""",CABECERA MUNICIPAL,57381771,JOSELINO SAMAYOA CASTILLO,MIGUEL ANGEL HERNNDEZ TӒREZ,DIVERSIFICADO,PRIVADO,URBANA,ABIERTA,MONOLINGUE,DOBLE,FIN DE SEMANA,HUEHUETENANGO
13-05-0054-46,13-014,HUEHUETENANGO,NENTON,"COLEGIO INTERCULTURAL PRIVADO MIXTO ""CIENCIA APLICADA""",CABECERA MUNICIPAL,57381713,JOSELINO SAMAYOA CASTILLO,MIGUEL ANGEL HERNNDEZ TӒREZ,DIVERSIFICADO,PRIVADO,URBANA,CERRADA TEMPORALMENTE,MONOLINGUE,DOBLE,FIN DE SEMANA,HUEHUETENANGO
13-05-0055-46,13-014,HUEHUETENANGO,NENTON,"COLEGIO INTERCULTURAL PRIVADO MIXTO ""CIENCIA APLICADA""",CABECERA MUNICIPAL,57381713,JOSELINO SAMAYOA CASTILLO,MIGUEL ANGEL HERNNDEZ TӒREZ,DIVERSIFICADO,PRIVADO,URBANA,ABIERTA,MONOLINGUE,SIN JORNADA,SEMIPRESENCIAL (FIN DE SEMANA),HUEHUETENANGO
13-05-0058-46,13-014,HUEHUETENANGO,NENTON,"COLEGIO PRIVADO MIXTO ""NENTONENSE""",CABECERA MUNICIPAL,50327661,JOSELINO SAMAYOA CASTILLO,ELVIN ABILIO LӐEZ GRANADOS,DIVERSIFICADO,PRIVADO,URBANA,ABIERTA,MONOLINGUE,SIN JORNADA,SEMIPRESENCIAL (UN D́ A LA SEMANA),HUEHUETENANGO
13-05-0061-46,13-014,HUEHUETENANGO,NENTON,INSTITUTO NACIONAL DE EDUCACIӎ DIVERSIFICADA,CABECERA MUNICIPAL,32303010,JOSELINO SAMAYOA CASTILLO,NILSAN SAYDETH MONTEJO MENDOZA DE MIGUEL,DIVERSIFICADO,OFICIAL,URBANA,ABIERTA,MONOLINGUE,VESPERTINA,DIARIO(REGULAR),HUEHUETENANGO
13-05-5932-46,13-014,HUEHUETENANGO,NENTON,COLEGIO EVANGELICO MIXTO LA VID VERDADERA,CABECERA MUNICIPAL,77800398,JOSELINO SAMAYOA CASTILLO,,DIVERSIFICADO,PRIVADO,URBANA,CERRADA TEMPORALMENTE,MONOLINGUE,DOBLE,DIARIO(REGULAR),HUEHUETENANGO
13-06-0052-46,13-017,HUEHUETENANGO,SAN PEDRO NECTA,"LICEO TECNOLOGICO ""FLOR DEL CAFE""",ALDEA RIO OCHO,40653620,EMIGDIO GUDIEL RAMOS LӐEZ,MAYNOR ALBERTO MART͎EZ VELSQUEZ,DIVERSIFICADO,PRIVADO,URBANA,CERRADA TEMPORALMENTE,MONOLINGUE,VESPERTINA,DIARIO(REGULAR),HUEHUETENANGO
13-06-0055-46,13-016,HUEHUETENANGO,SAN PEDRO NECTA,INSTITUTO NACIONAL DE EDUCACION DIVERSIFICADA,ALDEA EL TZALAY,49595406,MANRIQUE EZEQUIEL GӍEZ RECINOS,IRMA CLEMENTA HERNNDEZ VILLATORO,DIVERSIFICADO,OFICIAL,RURAL,ABIERTA,MONOLINGUE,VESPERTINA,DIARIO(REGULAR),HUEHUETENANGO
13-06-0061-46,13-017,HUEHUETENANGO,SAN PEDRO NECTA,CENTRO EDUCATIVO MAYA SOCIAL PARTICULAR BELAJ NOJ,ALDEA HUIXOC,40558094,EMIGDIO GUDIEL RAMOS LӐEZ,LEONIDAS OLIVERIO RU͚ CARDONA,DIVERSIFICADO,PRIVADO,RURAL,CERRADA TEMPORALMENTE,MONOLINGUE,VESPERTINA,DIARIO(REGULAR),HUEHUETENANGO
13-06-0065-46,13-017,HUEHUETENANGO,SAN PEDRO NECTA,LICEO PREUNIVERSITARIO MIXTO DEL VALLE,ALDEA EL PALMAR,57612234,EMIGDIO GUDIEL RAMOS LӐEZ,VILMA JUDITH NAVICHOQUE RECINOS DE CASTILLO,DIVERSIFICADO,COOPERATIVA,RURAL,CERRADA TEMPORALMENTE,MONOLINGUE,VESPERTINA,DIARIO(REGULAR),HUEHUETENANGO
13-06-0066-46,13-016,HUEHUETENANGO,SAN PEDRO NECTA,"COLEGIO MIXTO ""LA CONCORDIA""",CABECERA MUNICIPAL,50483080,MANRIQUE EZEQUIEL GӍEZ RECINOS,FRANCISCO ANTONIO CASTILLO CAMPOSECO,DIVERSIFICADO,PRIVADO,URBANA,ABIERTA,MONOLINGUE,DOBLE,FIN DE SEMANA,HUEHUETENANGO
13-06-0071-46,13-017,HUEHUETENANGO,SAN PEDRO NECTA,"COLEGIO PRIVADO MIXTO ""HISPANOAMERICANO""",ALDEA MICHICOY,53887063,EMIGDIO GUDIEL RAMOS LӐEZ,JORGE MɎDEZ GARĆ,DIVERSIFICADO,PRIVADO,RURAL,CERRADA TEMPORALMENTE,BILINGUE,DOBLE,FIN DE SEMANA,HUEHUETENANGO
13-06-0074-46,13-016,HUEHUETENANGO,SAN PEDRO NECTA,COLEGIO EVANGɌICO MIXTO GETSEMANͼ/td>,CALLE PRINCIPAL,42094931,MANRIQUE EZEQUIEL GӍEZ RECINOS,V̓TOR DAMIN VSQUEZ LӐEZ,DIVERSIFICADO,PRIVADO,URBANA,CERRADA TEMPORALMENTE,MONOLINGUE,DOBLE,FIN DE SEMANA,HUEHUETENANGO
13-06-0075-46,13-016,HUEHUETENANGO,SAN PEDRO NECTA,COLEGIO INTEGRAL EMPRESARIAL SAMPEDRANO POR MADUREZ,CABECERA MUNICIPAL,53217751,MANRIQUE EZEQUIEL GӍEZ RECINOS,IRIS LUĆ CIFUENTES MAZARIEGOS,DIVERSIFICADO,PRIVADO,URBANA,ABIERTA,MONOLINGUE,SIN JORNADA,SEMIPRESENCIAL (UN D́ A LA SEMANA),HUEHUETENANGO
13-06-0077-46,13-016,HUEHUETENANGO,SAN PEDRO NECTA,COLEGIO INTEGRAL EMPRESARIAL SAMPEDRANO POR MADUREZ,CABECERA MUNICIPAL,77226851,MANRIQUE EZEQUIEL GӍEZ RECINOS,IRIS LUĆ CIFUENTES MAZARIEGOS,DIVERSIFICADO,PRIVADO,URBANA,ABIERTA,MONOLINGUE,MATUTINA,DIARIO(REGULAR),HUEHUETENANGO
13-06-0078-46,13-016,HUEHUETENANGO,SAN PEDRO NECTA,COLEGIO INTEGRAL EMPRESARIAL SAMPEDRANO POR MADUREZ,CABECERA MUNICIPAL,77226851,MANRIQUE EZEQUIEL GӍEZ RECINOS,IRIS LUĆ CIFUENTES MAZARIEGOS,DIVERSIFICADO,PRIVADO,URBANA,ABIERTA,MONOLINGUE,DOBLE,FIN DE SEMANA,HUEHUETENANGO
13-06-5758-46,13-016,HUEHUETENANGO,SAN PEDRO NECTA,COLEGIO EVANGELICO MIXTO GETSEMANI,"SAN PEDRO NECTA, HUEHUETENANGO",77918301,MANRIQUE EZEQUIEL GӍEZ RECINOS,ORBELIO AGUST͎ CALDERӎ,DIVERSIFICADO,PRIVADO,URBANA,ABIERTA,MONOLINGUE,VESPERTINA,DIARIO(REGULAR),HUEHUETENANGO
13-06-6072-46,13-016,HUEHUETENANGO,SAN PEDRO NECTA,INSTITUTO PRIVADO MIXTO 'SAMPEDRANO',CANTON EL LLANO,44955412,MANRIQUE EZEQUIEL GӍEZ RECINOS,FRANCISCO ANTONIO CASTILLO CAMPOSECO,DIVERSIFICADO,PRIVADO,URBANA,ABIERTA,BILINGUE,VESPERTINA,DIARIO(REGULAR),HUEHUETENANGO
13-06-6756-46,13-016,HUEHUETENANGO,SAN PEDRO NECTA,COLEGIO EVANGɌICO MIXTO GETSEMANͼ/td>,CABECERA MUNICIPAL,77226921,MANRIQUE EZEQUIEL GӍEZ RECINOS,EMIGDIO GUDIEL RAMOS LӐEZ,DIVERSIFICADO,PRIVADO,URBANA,CERRADA TEMPORALMENTE,MONOLINGUE,DOBLE,DIARIO(REGULAR),HUEHUETENANGO
13-06-7127-46,13-016,HUEHUETENANGO,SAN PEDRO NECTA,COLEGIO INTEGRAL EMPRESARIAL SAMPEDRANO POR MADUREZ,CABECERA MUNICIPAL,47265892,MANRIQUE EZEQUIEL GӍEZ RECINOS,IRIS LUĆ CIFUENTES MAZARIEGOS,DIVERSIFICADO,PRIVADO,URBANA,CERRADA TEMPORALMENTE,MONOLINGUE,DOBLE,FIN DE SEMANA,HUEHUETENANGO
13-07-0016-46,13-051,HUEHUETENANGO,JACALTENANGO,INSTITUTO NACIONAL DE EDUCACION DIVERSIFICADA,CABECERA MUNICIPAL,48187061,CESAR GOD͎EZ GIRӎ,JUAN EDMUNDO DIAZ DELGADO,DIVERSIFICADO,OFICIAL,URBANA,CERRADA TEMPORALMENTE,MONOLINGUE,VESPERTINA,DIARIO(REGULAR),HUEHUETENANGO
13-07-0027-46,13-051,HUEHUETENANGO,JACALTENANGO,LICEO MIXTO PRIVADO CAMPOSECO,CANTON EL LLANO,54354793,CESAR GOD͎EZ GIRӎ,ERICK ALBERTO ROSALES GӍEZ,DIVERSIFICADO,PRIVADO,URBANA,ABIERTA,MONOLINGUE,MATUTINA,DIARIO(REGULAR),HUEHUETENANGO
13-07-0028-46,13-051,HUEHUETENANGO,JACALTENANGO,LICEO MIXTO PRIVADO CAMPOSECO,CANTON EL LLANO,77226326,CESAR GOD͎EZ GIRӎ,MANUEL DOMINGO CARDONA,DIVERSIFICADO,PRIVADO,URBANA,CERRADA TEMPORALMENTE,MONOLINGUE,NOCTURNA,DIARIO(REGULAR),HUEHUETENANGO
13-07-0029-46,13-051,HUEHUETENANGO,JACALTENANGO,LICEO MIXTO PRIVADO CAMPOSECO,CANTON EL LLANO,46498214,CESAR GOD͎EZ GIRӎ,SINDY SIOMARA JIMɎEZ SILVESTRE,DIVERSIFICADO,PRIVADO,URBANA,ABIERTA,MONOLINGUE,DOBLE,FIN DE SEMANA,HUEHUETENANGO
13-07-0036-46,13-051,HUEHUETENANGO,JACALTENANGO,ASOCIACION DE MAESTROS DE EDUCACION RURAL DE GUATEMALA -AMERG-,ALDEA CHEJBAL,53013050,CESAR GOD͎EZ GIRӎ,JESUS NATIVIDAD MONTEJO QUIяNEZ,DIVERSIFICADO,PRIVADO,RURAL,CERRADA TEMPORALMENTE,MONOLINGUE,DOBLE,FIN DE SEMANA,HUEHUETENANGO
13-07-0039-46,13-051,HUEHUETENANGO,JACALTENANGO,INSTITUTO MIXTO COMUNITARIO DE EDUCACION BILINGUE INTERCULTURAL QANIL,ALDE EL LIMONAR,0,CESAR GOD͎EZ GIRӎ,MARIA ADICELA SILVESTRE DOMINGO,DIVERSIFICADO,PRIVADO,RURAL,CERRADA TEMPORALMENTE,BILINGUE,DOBLE,FIN DE SEMANA,HUEHUETENANGO
13-07-0041-46,13-051,HUEHUETENANGO,JACALTENANGO,INSTITUTO MIXTO COMUNITARIO DE EDUCACION BILINGUE INTERCULTURA LA ASUNCION,ALDEA TZISBAJ,57220119,CESAR GOD͎EZ GIRӎ,ENRIQUE ARISMENDY CASTILLO JIMɎEZ,DIVERSIFICADO,PRIVADO,RURAL,CERRADA TEMPORALMENTE,BILINGUE,MATUTINA,DIARIO(REGULAR),HUEHUETENANGO
13-07-0043-46,13-051,HUEHUETENANGO,JACALTENANGO,INSTITUTO MIXTO COMUNITARIO DE EDUCACION BILINGUE INTERCULTURAL AL DESPERTAR,SAN MARCOS HUISTA,30568826,CESAR GOD͎EZ GIRӎ,FEBE ISIDORA JOSɠPɒEZ,DIVERSIFICADO,PRIVADO,RURAL,CERRADA TEMPORALMENTE,BILINGUE,VESPERTINA,DIARIO(REGULAR),HUEHUETENANGO
13-07-0045-46,13-051,HUEHUETENANGO,JACALTENANGO,ASOCIACIӎ DE MAESTROS DE EDUCACIӎ RURAL DE GUATEMALA -AMERG-,ALDEA CHEJBAL,40839394,CESAR GOD͎EZ GIRӎ,JESړ ERNESTO HERNNDEZ ROS,DIVERSIFICADO,PRIVADO,RURAL,CERRADA TEMPORALMENTE,BILINGUE,VESPERTINA,DIARIO(REGULAR),HUEHUETENANGO
13-07-0046-46,13-018,HUEHUETENANGO,JACALTENANGO,INSTITUTO MIXTO B`ALUNH Q`ANA,CANTӎ SAN SEBASTIN,77632581,CESAR GOD͎EZ GIRӎ,GREGORIO DELGADO CARDENAS,DIVERSIFICADO,PRIVADO,URBANA,CERRADA TEMPORALMENTE,BILINGUE,MATUTINA,DIARIO(REGULAR),HUEHUETENANGO
13-07-0047-46,13-051,HUEHUETENANGO,JACALTENANGO,"LICEO MIXTO ""JACALTECO""",CANTӎ PARROQUIA,30105278,CESAR GOD͎EZ GIRӎ,ELICEO MIGUEL JIMɎEZ ESTEBAN,DIVERSIFICADO,PRIVADO,URBANA,CERRADA TEMPORALMENTE,MONOLINGUE,MATUTINA,DIARIO(REGULAR),HUEHUETENANGO
13-07-0048-46,13-051,HUEHUETENANGO,JACALTENANGO,"INSITUTO MIXTO COMUNITARIO DE EDUCACIӎ BILING܅ INTERCULTURAL ""QANIL""",ALDEA EL LIMONAR,58095698,CESAR GOD͎EZ GIRӎ,EDITH NOHEM͠DOMINGO DOMINGO,DIVERSIFICADO,PRIVADO,RURAL,CERRADA TEMPORALMENTE,BILINGUE,VESPERTINA,DIARIO(REGULAR),HUEHUETENANGO
13-07-0049-46,13-051,HUEHUETENANGO,JACALTENANGO,"INSTITUTO MIXTO ""LA LAGUNA DE LAS FLORES""",ALDEA LA LAGUNA,46675152,CESAR GOD͎EZ GIRӎ,JOSɠALBERTO CASTILLO HURTADO,DIVERSIFICADO,PRIVADO,RURAL,CERRADA TEMPORALMENTE,BILINGUE,VESPERTINA,DIARIO(REGULAR),HUEHUETENANGO
13-07-0053-46,13-051,HUEHUETENANGO,JACALTENANGO,"COLEGIO PRIVADO MIXTO ""SAN JOSɠTZISBAJ""",ALDEA TZISBAJ,50315824,CESAR GOD͎EZ GIRӎ,JESړ BENIGNO DOMINGO D́Z,DIVERSIFICADO,PRIVADO,RURAL,CERRADA TEMPORALMENTE,BILINGUE,VESPERTINA,DIARIO(REGULAR),HUEHUETENANGO
13-07-0054-46,13-051,HUEHUETENANGO,JACALTENANGO,LICEO PRIVADO MIXTO INTERCULTURAL DE OCCIDENTE,ALDEA BUXUP,53736913,CESAR GOD͎EZ GIRӎ,JENRY JUAN DELGADO D́Z,DIVERSIFICADO,PRIVADO,RURAL,ABIERTA,MONOLINGUE,VESPERTINA,DIARIO(REGULAR),HUEHUETENANGO
13-07-0055-46,13-051,HUEHUETENANGO,JACALTENANGO,"INSTITUTO PRIVADO MIXTO DIVERSIFICADO ""JACALTENANGO""",CANTӎ SAN SEBASTIN,55273723,CESAR GOD͎EZ GIRӎ,JOSɠFIDENCIO DELGADO HERNNDEZ,DIVERSIFICADO,PRIVADO,URBANA,ABIERTA,BILINGUE,VESPERTINA,DIARIO(REGULAR),HUEHUETENANGO
13-07-0056-46,13-051,HUEHUETENANGO,JACALTENANGO,"INSTITUTO PRIVADO MIXTO DIVERSIFICADO ""JACALTENANGO""",CANTӎ SAN SEBASTIN,59851269,CESAR GOD͎EZ GIRӎ,JOSɠFIDENCIO DELGADO HERNNDEZ,DIVERSIFICADO,PRIVADO,RURAL,ABIERTA,MONOLINGUE,DOBLE,DIARIO(REGULAR),HUEHUETENANGO
13-07-0063-46,13-051,HUEHUETENANGO,JACALTENANGO,"INSTITUTO PRIVADO MIXTO DIVERSIFICADO ""JACALTENANGO""",CANTӎ SAN SEBASTIAN,59851269,CESAR GOD͎EZ GIRӎ,MAŔ SALOMɠROS SNCHEZ,DIVERSIFICADO,PRIVADO,URBANA,CERRADA TEMPORALMENTE,MONOLINGUE,DOBLE,FIN DE SEMANA,HUEHUETENANGO
13-07-0064-46,13-051,HUEHUETENANGO,JACALTENANGO,"INSTITUTO PRIVADO MIXTO DIVERSIFICADO ""JACALTENANGO""",CANTӎ SAN SEBASTIAN,59851269,CESAR GOD͎EZ GIRӎ,MAŔ SALOMɠROS SNCHEZ,DIVERSIFICADO,PRIVADO,URBANA,ABIERTA,MONOLINGUE,DOBLE,FIN DE SEMANA,HUEHUETENANGO
13-07-0066-46,13-051,HUEHUETENANGO,JACALTENANGO,"CENTRO EDUCATIVO COMUNITARIO ""SAN JOSɠTZISBAJ""","CANTӎ PARROQUIA, ALDEA TZISBAJ",50601736,CESAR GOD͎EZ GIRӎ,CAYETANO JIMɎEZ DOMINGO,DIVERSIFICADO,PRIVADO,RURAL,ABIERTA,BILINGUE,VESPERTINA,DIARIO(REGULAR),HUEHUETENANGO
13-07-0067-46,13-051,HUEHUETENANGO,JACALTENANGO,INSTITUTO NACIONAL DE EDUCACIӎ DIVERSIFICADA,CANTӎ SAN SEBASTIN,30156980,CESAR GOD͎EZ GIRӎ,JESړ RODOLFO CAMPOSECO SILVESTRE,DIVERSIFICADO,OFICIAL,URBANA,ABIERTA,MONOLINGUE,DOBLE,DIARIO(REGULAR),HUEHUETENANGO
13-07-0068-46,13-060,HUEHUETENANGO,JACALTENANGO,CENTRO DE EDUCACIӎ EXTRAESCOLAR CEEX,CABECERA MUNICIPAL,32124222,AROLDO HOSBERI SOSA LӐEZ,ADELAIDA MAŔ HURTADO LӐEZ,DIVERSIFICADO,PRIVADO,URBANA,ABIERTA,MONOLINGUE,DOBLE,SEMIPRESENCIAL,HUEHUETENANGO
13-07-0071-46,13-051,HUEHUETENANGO,JACALTENANGO,INSTITUTO NACIONAL DE EDUCACION DIVERSIFICADA,ALDEA SAN MARCOS HUISTA,58805828,CESAR GOD͎EZ GIRӎ,ANDRɓ ROLANDO RAM͒EZ MATEO,DIVERSIFICADO,OFICIAL,RURAL,CERRADA TEMPORALMENTE,MONOLINGUE,VESPERTINA,DIARIO(REGULAR),HUEHUETENANGO
13-07-0072-46,13-051,HUEHUETENANGO,JACALTENANGO,"LICEO MIXTO PRIVADO ""CAMPOSECO""",CANTӎ EL LLANO,77226327,CESAR GOD͎EZ GIRӎ,SINDY SIOMARA JIMɎEZ SILVESTRE,DIVERSIFICADO,PRIVADO,URBANA,ABIERTA,MONOLINGUE,SIN JORNADA,SEMIPRESENCIAL (UN D́ A LA SEMANA),HUEHUETENANGO
13-07-0074-46,13-051,HUEHUETENANGO,JACALTENANGO,COLEGIO PREUNIVERSITARIO ROYAL,"ZONA 1, CANTӎ PARROQUIA",45508304,CESAR GOD͎EZ GIRӎ,MIGUEL FRANCISCO RAM͒EZ,DIVERSIFICADO,PRIVADO,URBANA,ABIERTA,MONOLINGUE,MATUTINA,DIARIO(REGULAR),HUEHUETENANGO
13-07-0075-46,13-051,HUEHUETENANGO,JACALTENANGO,INSTITUTO NACIONAL TECNOLӇICO,CANTӎ SAN SEBASTIN,50659832,CESAR GOD͎EZ GIRӎ,JOSɠISMAEL D́Z MONTEJO,DIVERSIFICADO,OFICIAL,URBANA,ABIERTA,MONOLINGUE,DOBLE,DIARIO(REGULAR),HUEHUETENANGO
13-07-0433-46,13-051,HUEHUETENANGO,JACALTENANGO,INSTITUTO MIXTO B ALUNH Q ANA,CANTON SAN SEBASTIAN,77632533-77632581,CESAR GOD͎EZ GIRӎ,SEBASTIN PRUDENCIO HERNNDEZ,DIVERSIFICADO,PRIVADO,URBANA,CERRADA TEMPORALMENTE,BILINGUE,VESPERTINA,DIARIO(REGULAR),HUEHUETENANGO
13-07-6385-46,13-051,HUEHUETENANGO,JACALTENANGO,INSTITUTO PRIVADO MIXTO DIVERSIFICADO JACALTENANGO,CANTӎ SAN SEBASTIN,55273723,CESAR GOD͎EZ GIRӎ,JOSɠFIDENCIO DELGADO HERNNDEZ,DIVERSIFICADO,PRIVADO,URBANA,ABIERTA,BILINGUE,MATUTINA,DIARIO(REGULAR),HUEHUETENANGO
13-07-6871-46,13-051,HUEHUETENANGO,JACALTENANGO,LICEO MIXTO PRIVADO CAMPOSECO,CANTON LLANO,77226327,CESAR GOD͎EZ GIRӎ,SINDY SIOMARA JIMɎEZ SILVESTRE,DIVERSIFICADO,PRIVADO,URBANA,ABIERTA,MONOLINGUE,VESPERTINA,DIARIO(REGULAR),HUEHUETENANGO
13-07-6872-46,13-051,HUEHUETENANGO,JACALTENANGO,LICEO MIXTO PRIVADO CAMPOSECO,CANTON LLANO,58405294,CESAR GOD͎EZ GIRӎ,SINDY SIOMARA JIMɎEZ SILVESTRE,DIVERSIFICADO,PRIVADO,URBANA,CERRADA TEMPORALMENTE,MONOLINGUE,DOBLE,FIN DE SEMANA,HUEHUETENANGO
13-08-0020-46,13-021,HUEHUETENANGO,SAN PEDRO SOLOMA,INSTITUTO NACIONAL DE EDUCACION DIVERSIFICADA,CABECERA MUNICIPAL,,ROMEO MONTEJO D́Z,---,DIVERSIFICADO,OFICIAL,RURAL,CERRADA TEMPORALMENTE,MONOLINGUE,MATUTINA,DIARIO(REGULAR),HUEHUETENANGO
13-08-0042-46,13-020,HUEHUETENANGO,SAN PEDRO SOLOMA,COLEGIO JUAN JACOBO ROUSSEAU,"BARRIO ESQUIPULAS, ZONA 6",77806985,ROMEO MONTEJO D́Z,MARVIN GERARDO MIGUEL MONTEJO,DIVERSIFICADO,PRIVADO,URBANA,CERRADA TEMPORALMENTE,MONOLINGUE,VESPERTINA,DIARIO(REGULAR),HUEHUETENANGO
13-08-0045-46,13-020,HUEHUETENANGO,SAN PEDRO SOLOMA,"INSTITUTO PARTICULAR MIXTO INTERCULTURAL ""CIENCIA Y DESARROLLO""","BARRIO ESQUIPULAS, ZONA 6",77806985,ROMEO MONTEJO D́Z,JAIME ESTUARDO DOM͎GUEZ RODAS,DIVERSIFICADO,PRIVADO,URBANA,ABIERTA,MONOLINGUE,DOBLE,FIN DE SEMANA,HUEHUETENANGO
13-08-0046-46,13-020,HUEHUETENANGO,SAN PEDRO SOLOMA,INSTITUTO NORMAL MIXTO PRIVADO,"BARRIO EL CARMEN, ZONA 2",77719364,ROMEO MONTEJO D́Z,RONI GEPCER CANO CASTELLANOS,DIVERSIFICADO,PRIVADO,URBANA,ABIERTA,MONOLINGUE,VESPERTINA,DIARIO(REGULAR),HUEHUETENANGO
13-08-0047-46,13-020,HUEHUETENANGO,SAN PEDRO SOLOMA,INSTITUTO PARTICULAR MIXTO INTERCULTURAL CIENCIA Y DESARROLLO,BARRIO ESQUIPULAS ZONA 6,77800698,ROMEO MONTEJO D́Z,ROSALIO TELEGUARIO MAGZUL,DIVERSIFICADO,PRIVADO,URBANA,CERRADA TEMPORALMENTE,MONOLINGUE,DOBLE,FIN DE SEMANA,HUEHUETENANGO
13-08-0049-46,13-020,HUEHUETENANGO,SAN PEDRO SOLOMA,LICEO TɃNICO LIBERADOR KAROL WOJTILA,BARRIO COTZAN,45281085,ROMEO MONTEJO D́Z,ANDRɓ BONIFACIO LӐEZ ANDRɓ,DIVERSIFICADO,PRIVADO,RURAL,ABIERTA,MONOLINGUE,VESPERTINA,DIARIO(REGULAR),HUEHUETENANGO
13-08-0053-46,13-020,HUEHUETENANGO,SAN PEDRO SOLOMA,INSTITUTO PARTICULAR MIXTO INTERCULTURAL CIENCIA Y DESARROLLO,BARRIO ESQUIPULAS,77806985,ROMEO MONTEJO D́Z,ROSAL͏ TELEGUARIO MAGZUL,DIVERSIFICADO,PRIVADO,URBANA,CERRADA TEMPORALMENTE,MONOLINGUE,MATUTINA,DIARIO(REGULAR),HUEHUETENANGO
13-08-0055-46,13-020,HUEHUETENANGO,SAN PEDRO SOLOMA,"COLEGIO LICEO TɃNICO LIBERADOR ""KAROL WOJTILA""",BARRIO COTZAN,45281085,ROMEO MONTEJO D́Z,NIDIA KARINA ESCOBEDO MORALES,DIVERSIFICADO,PRIVADO,URBANA,CERRADA TEMPORALMENTE,MONOLINGUE,DOBLE,FIN DE SEMANA,HUEHUETENANGO
13-08-0058-46,13-020,HUEHUETENANGO,SAN PEDRO SOLOMA,"COLEGIO LICEO TɃNICO LIBERADOR ""KAROL WOJTILA""",BARRIO COTZAN,45281085,ROMEO MONTEJO D́Z,NIDIA KARINA ESCOBEDO MORALES,DIVERSIFICADO,PRIVADO,URBANA,ABIERTA,MONOLINGUE,DOBLE,FIN DE SEMANA,HUEHUETENANGO
