CODIGO,DISTRITO,DEPARTAMENTO,MUNICIPIO,ESTABLECIMIENTO,DIRECCION,TELEFONO,SUPERVISOR,DIRECTOR,NIVEL,SECTOR,AREA,STATUS,MODALIDAD,JORNADA,PLAN,DEPARTAMENTAL
13-01-0390-46,13-004,HUEHUETENANGO,HUEHUETENANGO,COLEGIO PRIVADO MIXTO NUEVO AMANECER,"3A. CALLE FINAL, EL CALVARIO ZONA 3",77657960,CLARA ARMIDA MORALES CASTILLO,DMARIS JULISSA VILLATORO RECINOS,DIVERSIFICADO,PRIVADO,URBANA,ABIERTA,MONOLINGUE,SIN JORNADA,SEMIPRESENCIAL (UN D́ A LA SEMANA),HUEHUETENANGO
13-01-0391-46,13-004,HUEHUETENANGO,HUEHUETENANGO,LICEO PRIVADO DE CIENCIAS COMERICALES,CABECERA MUNICIPAL,77640126,CLARA ARMIDA MORALES CASTILLO,MARLIN MARIBEL HERNNDEZ CASTILLO,DIVERSIFICADO,PRIVADO,URBANA,ABIERTA,MONOLINGUE,SIN JORNADA,SEMIPRESENCIAL (FIN DE SEMANA),HUEHUETENANGO
13-01-0392-46,13-004,HUEHUETENANGO,HUEHUETENANGO,CENTRO EDUCATIVO MARRIOT BRILLANTE,"5A AVENIDA ""A"" 5-80 ZONA 1",77648219,CLARA ARMIDA MORALES CASTILLO,MARIO ARNOLDO HERNANDEZ LORENZO,DIVERSIFICADO,PRIVADO,URBANA,ABIERTA,MONOLINGUE,SIN JORNADA,SEMIPRESENCIAL (FIN DE SEMANA),HUEHUETENANGO
13-01-0396-46,13-004,HUEHUETENANGO,HUEHUETENANGO,LICEO PREUNIVERSITARIO DE INFORMTICA,4A. AVENIDA 1-30 ZONA 1,77648784,CLARA ARMIDA MORALES CASTILLO,NIVEA MARINA RIVAS GUTIɒREZ,DIVERSIFICADO,PRIVADO,URBANA,ABIERTA,MONOLINGUE,SIN JORNADA,SEMIPRESENCIAL (UN D́ A LA SEMANA),HUEHUETENANGO
13-01-0399-46,13-004,HUEHUETENANGO,HUEHUETENANGO,COLEGIO MIXTO PRӃERES PLUS,2A AVENIDA 4-04 ZONA 3,49117821,CLARA ARMIDA MORALES CASTILLO,CARLOS NOVEL GUTIɒREZ MORALES,DIVERSIFICADO,PRIVADO,URBANA,ABIERTA,MONOLINGUE,SIN JORNADA,SEMIPRESENCIAL (UN D́ A LA SEMANA),HUEHUETENANGO
13-01-0400-46,13-004,HUEHUETENANGO,HUEHUETENANGO,"COLEGIO PRIVADO MIXTO ""EL DIVINO MAESTRO""",ALDEA XINAXOJ,50486759,CLARA ARMIDA MORALES CASTILLO,ARGELIO DE JESړ LӐEZ VILLATORO,DIVERSIFICADO,PRIVADO,RURAL,ABIERTA,MONOLINGUE,SIN JORNADA,SEMIPRESENCIAL (UN D́ A LA SEMANA),HUEHUETENANGO
13-01-0401-46,13-050,HUEHUETENANGO,HUEHUETENANGO,"LICEO PRIVADO MIXTO ""MINERVA""",5A. CALLE 3-28 ZONA 2,49002083,REYNALDO RECINOS CASTILLO,ULISES OMAR CALDERӎ CARDONA,DIVERSIFICADO,PRIVADO,URBANA,ABIERTA,MONOLINGUE,SIN JORNADA,SEMIPRESENCIAL (UN D́ A LA SEMANA),HUEHUETENANGO
13-01-0403-46,13-004,HUEHUETENANGO,HUEHUETENANGO,COLEGIO TECNOLӇICO DEL VALLE,5A. AVENIDA 1-25 ZONA 8,41779500,CLARA ARMIDA MORALES CASTILLO,ROSWIN JOSEF GӍEZ AGUSTIN,DIVERSIFICADO,PRIVADO,URBANA,ABIERTA,MONOLINGUE,SIN JORNADA,SEMIPRESENCIAL (UN D́ A LA SEMANA),HUEHUETENANGO
13-01-0408-46,13-004,HUEHUETENANGO,HUEHUETENANGO,COLEGIO PRIVADO MIXTO HERMANO PEDRO,ZACULEU CENTRAL ZONA 9,57699663,CLARA ARMIDA MORALES CASTILLO,LILIA CARMELA LӐEZ LӐEZ,DIVERSIFICADO,PRIVADO,URBANA,ABIERTA,MONOLINGUE,SIN JORNADA,SEMIPRESENCIAL (UN D́ A LA SEMANA),HUEHUETENANGO
13-01-0409-46,13-004,HUEHUETENANGO,HUEHUETENANGO,COLEGIO PRIVADO MIXTO AMERICANO,3A AVENIDA 1-40 ZONA 3,77642424,CLARA ARMIDA MORALES CASTILLO,JAIME LUIS LӐEZ MENDӚA,DIVERSIFICADO,PRIVADO,URBANA,ABIERTA,MONOLINGUE,SIN JORNADA,SEMIPRESENCIAL (UN D́ A LA SEMANA),HUEHUETENANGO
13-01-0411-46,13-050,HUEHUETENANGO,HUEHUETENANGO,"LICEO CRISTIANO ""NUEVOS HORIZONTES""",CABECERA MUNICIPAL,51710882,REYNALDO RECINOS CASTILLO,MATEO GӍEZ Y GӍEZ,DIVERSIFICADO,PRIVADO,URBANA,ABIERTA,MONOLINGUE,SIN JORNADA,SEMIPRESENCIAL (UN D́ A LA SEMANA),HUEHUETENANGO
13-01-0413-46,13-050,HUEHUETENANGO,HUEHUETENANGO,LICEO PRIVADO MIXTO CENTROAMERICANO HUEHUETECO,5A. CALLE 11-66 ZONA 1,49664813,REYNALDO RECINOS CASTILLO,FLOR DE MARIA CASTILLO LӐEZ,DIVERSIFICADO,PRIVADO,URBANA,ABIERTA,MONOLINGUE,SIN JORNADA,SEMIPRESENCIAL (UN D́ A LA SEMANA),HUEHUETENANGO
13-01-0415-46,13-004,HUEHUETENANGO,HUEHUETENANGO,"COLEGIO EVANGɌICO PARA ADULTOS GUATEMALTECOS ""EL SHADDAI""",6TA. AVENIDA COLONIA MAKEPEACE ZONA 1,77643534,CLARA ARMIDA MORALES CASTILLO,LUDDWIK MISSAEL GӍEZ RIVAS,DIVERSIFICADO,PRIVADO,URBANA,ABIERTA,MONOLINGUE,SIN JORNADA,SEMIPRESENCIAL (UN D́ A LA SEMANA),HUEHUETENANGO
13-01-0417-46,13-004,HUEHUETENANGO,HUEHUETENANGO,COLEGIO EUROPEO,6A. AVENIDA 6-11 ZONA 1,55127042,CLARA ARMIDA MORALES CASTILLO,LUISA FERNANDA GRANADOS RIVERA,DIVERSIFICADO,PRIVADO,URBANA,ABIERTA,MONOLINGUE,MATUTINA,DIARIO(REGULAR),HUEHUETENANGO
13-01-0419-46,13-004,HUEHUETENANGO,HUEHUETENANGO,COLEGIO EUROPEO,6A. AVENIDA 6-11 ZONA 1,54144029,CLARA ARMIDA MORALES CASTILLO,LUISA FERNANDA GRANADOS RIVERA,DIVERSIFICADO,PRIVADO,URBANA,ABIERTA,MONOLINGUE,SIN JORNADA,SEMIPRESENCIAL (UN D́ A LA SEMANA),HUEHUETENANGO
13-01-0420-46,13-004,HUEHUETENANGO,HUEHUETENANGO,COLEGIO DE MړICA FREDERICK CHOPIN,ZACULEU CENTRAL ZONA 9,33518150,CLARA ARMIDA MORALES CASTILLO,CLAUDIA DARINKA ELIZABEETRH LӐEZ GUTIɒREZ,DIVERSIFICADO,PRIVADO,URBANA,ABIERTA,MONOLINGUE,MATUTINA,DIARIO(REGULAR),HUEHUETENANGO
13-01-0421-46,13-050,HUEHUETENANGO,HUEHUETENANGO,INSTITUTO NACIONAL DE EDUCACIӎ DIVERSIFICADA,"9O. CALLEJӎ ""B"" 12-94 ZONA 4 SECTOR LOS OLIVOS ""EL TERRERO""",31098005,REYNALDO RECINOS CASTILLO,ROXANA FABIOLA PALACIOS FɌIX,DIVERSIFICADO,OFICIAL,RURAL,ABIERTA,MONOLINGUE,DOBLE,FIN DE SEMANA,HUEHUETENANGO
13-01-0423-46,13-060,HUEHUETENANGO,HUEHUETENANGO,CENTRO DE EDUCACIӎ EXTRAESCOLAR CEEX MUNICIPAL,CORRAL CHIQUITO ZONA 8,59541012,AROLDO HOSBERI SOSA LӐEZ,THELMA ASUCENA MENDOZA MENDOZA DE CARRILLO,DIVERSIFICADO,PRIVADO,URBANA,ABIERTA,MONOLINGUE,DOBLE,SEMIPRESENCIAL,HUEHUETENANGO
13-01-0425-46,13-004,HUEHUETENANGO,HUEHUETENANGO,COLEGIO PREUNIVERSITARIO CIENTIFICO,"2A. AVENIDA ""A"" 1-36 ZONA 3, EL CALVARIO",77648784,CLARA ARMIDA MORALES CASTILLO,ALVARO OTONIEL MART͎EZ RODRIGUEZ,DIVERSIFICADO,PRIVADO,URBANA,ABIERTA,MONOLINGUE,DOBLE,FIN DE SEMANA,HUEHUETENANGO
13-01-0426-46,13-050,HUEHUETENANGO,HUEHUETENANGO,"COLEGIO PREUNIVERSITARIO ""ALBERT EINSTEIN""","11. AVENIDA ""A"" 1-45 CORRAL CHIQUITO ZONA 8",79345932,REYNALDO RECINOS CASTILLO,SUSANA GUADALUPE ARREOLA DONIS,DIVERSIFICADO,PRIVADO,URBANA,ABIERTA,MONOLINGUE,MATUTINA,DIARIO(REGULAR),HUEHUETENANGO
13-01-0427-46,13-050,HUEHUETENANGO,HUEHUETENANGO,COLEGIO REAL AMERICANO,7A. CALLE 12-75 ZONA 5 COLONIA LA HONDONADA,77252085,REYNALDO RECINOS CASTILLO,ANA KARINA GORDILLO ALVARADO,DIVERSIFICADO,PRIVADO,URBANA,ABIERTA,MONOLINGUE,MATUTINA,DIARIO(REGULAR),HUEHUETENANGO
13-01-1498-46,13-004,HUEHUETENANGO,HUEHUETENANGO,COLEGIO EVANGELICO 'JERUSALEN',ALDEA LAS LAGUNAS ZONA 10,79342847,CLARA ARMIDA MORALES CASTILLO,,DIVERSIFICADO,PRIVADO,RURAL,CERRADA TEMPORALMENTE,MONOLINGUE,VESPERTINA,DIARIO(REGULAR),HUEHUETENANGO
13-01-1500-46,13-004,HUEHUETENANGO,HUEHUETENANGO,LICEO PRIVADO DE CIENCIAS COMERCIALES,5TA. AV. 7-112 ZONA 1,77640126,CLARA ARMIDA MORALES CASTILLO,MARLIN MARIBEL HERNNDEZ CASTILLO,DIVERSIFICADO,PRIVADO,URBANA,ABIERTA,MONOLINGUE,MATUTINA,DIARIO(REGULAR),HUEHUETENANGO
13-01-1501-46,13-004,HUEHUETENANGO,HUEHUETENANGO,INSTITUTO PRIVADO HUEHUETECO,"5A. CALLE Y 9A. AVENIDA, INTERIOR DE LA ZONA 1",77645768,CLARA ARMIDA MORALES CASTILLO,SAMUEL CESAR SOSA HERRERA,DIVERSIFICADO,PRIVADO,URBANA,CERRADA TEMPORALMENTE,MONOLINGUE,DOBLE,FIN DE SEMANA,HUEHUETENANGO
13-01-1502-46,,HUEHUETENANGO,HUEHUETENANGO,INSTITUTO PRIVADO MIXTO DE EDUCACION DIVERSIFICADA 'RAFAEL LANDIVAR',5A. CALLE 11-20 ZONA 1,,,,DIVERSIFICADO,PRIVADO,URBANA,CERRADA TEMPORALMENTE,MONOLINGUE,NOCTURNA,DIARIO(REGULAR),HUEHUETENANGO
13-01-1505-46,13-050,HUEHUETENANGO,HUEHUETENANGO,LICEO PRIVADO MIXTO CENTROAMERICANO HUEHUETECO,5A. CALLE 11-66 ZONA 1,49664813,REYNALDO RECINOS CASTILLO,FLOR DE MARIA CASTILLO LӐEZ,DIVERSIFICADO,PRIVADO,URBANA,ABIERTA,MONOLINGUE,DOBLE,FIN DE SEMANA,HUEHUETENANGO
13-01-1584-46,13-004,HUEHUETENANGO,HUEHUETENANGO,COLEGIO PRIVADO MIXTO AMERICANO,3AV. 1-140 ZONA 3,77649742,CLARA ARMIDA MORALES CASTILLO,JAIME LUIS LӐEZ MENDӚA,DIVERSIFICADO,PRIVADO,URBANA,ABIERTA,MONOLINGUE,VESPERTINA,DIARIO(REGULAR),HUEHUETENANGO
13-01-1592-46,13-004,HUEHUETENANGO,HUEHUETENANGO,COLEGIO PRIVADO MIXTO AMERICANO,3A. AVENIDA 1-140 ZONA 3,77649742,CLARA ARMIDA MORALES CASTILLO,JAIME LUIS LӐEZ MENDӚA,DIVERSIFICADO,PRIVADO,URBANA,ABIERTA,MONOLINGUE,MATUTINA,DIARIO(REGULAR),HUEHUETENANGO
13-01-1685-46,13-050,HUEHUETENANGO,HUEHUETENANGO,COLEGIO PRIVADO MIXTO 'RAFAEL LANDIVAR',5A. CALLE 11-65 ZONA 1,77646933,REYNALDO RECINOS CASTILLO,,DIVERSIFICADO,PRIVADO,URBANA,TEMPORAL TITULOS,MONOLINGUE,VESPERTINA,DIARIO(REGULAR),HUEHUETENANGO
13-01-4860-46,13-050,HUEHUETENANGO,HUEHUETENANGO,COLEGIO MIXTO ASTURIAS,2A. CALLE 7-32 INTERIOR ZONA 1,77640625,REYNALDO RECINOS CASTILLO,ANABELA CLARISA MɎDEZ ESCOBEDO,DIVERSIFICADO,PRIVADO,URBANA,CERRADA TEMPORALMENTE,MONOLINGUE,MATUTINA,DIARIO(REGULAR),HUEHUETENANGO
13-01-4861-46,13-004,HUEHUETENANGO,HUEHUETENANGO,COLEGIO PRIVADO MIXTO DEL NIVEL MEDIO LICEO HUEHUETECO,4A.CALLE 8-80 ZONA 4,77642089,CLARA ARMIDA MORALES CASTILLO,NESTOR FERNANDO COBӎ LӐEZ,DIVERSIFICADO,PRIVADO,URBANA,CERRADA TEMPORALMENTE,MONOLINGUE,VESPERTINA,DIARIO(REGULAR),HUEHUETENANGO
13-01-4966-46,13-004,HUEHUETENANGO,HUEHUETENANGO,INSTITUTO DIVERSIFICADO DE PERITO EN ADMINISTRACIӎ PڂLICA J.V.,6A. AVENIDA A 10-59 ZONA 1,77649716,CLARA ARMIDA MORALES CASTILLO,DELMAR ELEAZAR PALACIOS LUCAS,DIVERSIFICADO,OFICIAL,URBANA,ABIERTA,MONOLINGUE,VESPERTINA,DIARIO(REGULAR),HUEHUETENANGO
13-01-5108-46,13-050,HUEHUETENANGO,HUEHUETENANGO,COLEGIO EVANGELICO PRIVADO 'BETH SHALOM',3A. AVENIDA FINAL ZONA 3,77649291,REYNALDO RECINOS CASTILLO,,DIVERSIFICADO,PRIVADO,URBANA,TEMPORAL TITULOS,MONOLINGUE,MATUTINA,DIARIO(REGULAR),HUEHUETENANGO
13-01-5307-46,,HUEHUETENANGO,HUEHUETENANGO,IPMB Y BACHILLERATO POR MADUREZ 'DR. JORGE VIDES MOLINA',LAS LAGUNAS ZONA 9,,,,DIVERSIFICADO,PRIVADO,RURAL,CERRADA TEMPORALMENTE,MONOLINGUE,DOBLE,SABATINO,HUEHUETENANGO
13-01-5358-46,13-004,HUEHUETENANGO,HUEHUETENANGO,COLEGIO PRIVADO MIXTO GABRIELA MISTRAL,5A. AVENIDA 7-147 ZONA 1,77641004,CLARA ARMIDA MORALES CASTILLO,NIVEA MARINA RIVAS GUTIERREZ,DIVERSIFICADO,PRIVADO,URBANA,CERRADA TEMPORALMENTE,MONOLINGUE,VESPERTINA,DIARIO(REGULAR),HUEHUETENANGO
13-01-5500-46,13-050,HUEHUETENANGO,HUEHUETENANGO,COLEGIO TECNOLӇICO EN COMPUTACIӎ,2DA. CALLE 6-49 ZONA 1,77641301,REYNALDO RECINOS CASTILLO,OLIVER BOANERGES RECINOS RECINOS,DIVERSIFICADO,PRIVADO,URBANA,CERRADA TEMPORALMENTE,MONOLINGUE,VESPERTINA,DIARIO(REGULAR),HUEHUETENANGO
13-01-5756-46,,HUEHUETENANGO,HUEHUETENANGO,INSTITUTO DIVERSIFICADO PRIVADO MIXTO 'LUIS ARTURO LEMUS',3A. CALLE Y 4A. AVENIDA ZONA 9 ALDEA ZACULEU CENTRAL,57 47546,,,DIVERSIFICADO,PRIVADO,RURAL,CERRADA TEMPORALMENTE,MONOLINGUE,MATUTINA,DIARIO(REGULAR),HUEHUETENANGO
13-01-6042-46,13-004,HUEHUETENANGO,HUEHUETENANGO,LICEO MIXTO CANADIENSE DE OCCIDENTE,"7MA. CALLE 12-75, ZONA 5 COLONIA LA HONDONADA HUEHUETENANGO",77250964,CLARA ARMIDA MORALES CASTILLO,JULIO RENɠCALDERӎ FLORES,DIVERSIFICADO,PRIVADO,URBANA,CERRADA TEMPORALMENTE,MONOLINGUE,MATUTINA,DIARIO(REGULAR),HUEHUETENANGO
13-01-6096-46,13-004,HUEHUETENANGO,HUEHUETENANGO,COLEGIO PRIVADO MIXTO DEL NIVEL MEDIO LICEO HUEHUETECO,4A CALLE 8-80 ZONA 4.,77642089,CLARA ARMIDA MORALES CASTILLO,NESTOR FERNANDO COBӎ LӐEZ,DIVERSIFICADO,PRIVADO,URBANA,ABIERTA,MONOLINGUE,MATUTINA,DIARIO(REGULAR),HUEHUETENANGO
13-01-6304-46,13-004,HUEHUETENANGO,HUEHUETENANGO,COLEGIO PRIVADO MIXTO SAN LORENZO,5A. CALLE 1ER ACCESO 5-75 ZONA 5,77645768,CLARA ARMIDA MORALES CASTILLO,IRMA REGINA VELSQUEZ ESCOBEDO,DIVERSIFICADO,PRIVADO,URBANA,ABIERTA,MONOLINGUE,MATUTINA,DIARIO(REGULAR),HUEHUETENANGO
13-01-6306-46,13-004,HUEHUETENANGO,HUEHUETENANGO,CENTRO EDUCATIVO PARA ADULTOS 'GUATEMALA',6A. AV. C 8A. CALLE 8-30 COL. MAKEPEACE ZONA 1,77643494,CLARA ARMIDA MORALES CASTILLO,,DIVERSIFICADO,PRIVADO,URBANA,CERRADA TEMPORALMENTE,MONOLINGUE,DOBLE,FIN DE SEMANA,HUEHUETENANGO
13-01-6367-46,13-004,HUEHUETENANGO,HUEHUETENANGO,INSTITUTO EVANGELICO MIXTO BEREA,ALDEA LAS LAGUNAS ZONA 10,77642767,CLARA ARMIDA MORALES CASTILLO,ROLANDO INOCENTE OROZCO OROZCO,DIVERSIFICADO,PRIVADO,RURAL,CERRADA TEMPORALMENTE,MONOLINGUE,DOBLE,FIN DE SEMANA,HUEHUETENANGO
13-01-6369-46,13-004,HUEHUETENANGO,HUEHUETENANGO,ESCUELA NORMAL DE EDUCACION FISICA,ZACULEU CENTRAL ZONA 9,,CLARA ARMIDA MORALES CASTILLO,MANUEL DEMETRIO FERNNDEZ RAMOS,DIVERSIFICADO,OFICIAL,URBANA,ABIERTA,MONOLINGUE,DOBLE,DIARIO(REGULAR),HUEHUETENANGO
13-01-6370-46,13-050,HUEHUETENANGO,HUEHUETENANGO,ESCUELA NORMAL BILINGUE INTERCULTURAL JAXNAQTZAL MAM KYE AJXNAQTZAL,"12 CALLE 1-50, ZONA 5 COLONIA LOS ENCINOS",77642053,REYNALDO RECINOS CASTILLO,MARCO TULIO DOMINGO MACARIO,DIVERSIFICADO,OFICIAL,URBANA,ABIERTA,BILINGUE,MATUTINA,DIARIO(REGULAR),HUEHUETENANGO
13-01-6371-46,13-004,HUEHUETENANGO,HUEHUETENANGO,COLEGIO MIXTO INTEGRAL JUANA DE ARCO,"9A. CALLE ""A"" 13-21, ZONA 5",77647734,CLARA ARMIDA MORALES CASTILLO,AUGUSTO RUFINO TELLO GARCIA,DIVERSIFICADO,PRIVADO,URBANA,CERRADA TEMPORALMENTE,MONOLINGUE,MATUTINA,DIARIO(REGULAR),HUEHUETENANGO
13-01-6391-46,13-050,HUEHUETENANGO,HUEHUETENANGO,COLEGIO PRIVADO MIXTO 'EMANUEL',LO DE HERNANDEZ ZONA 7,,REYNALDO RECINOS CASTILLO,,DIVERSIFICADO,PRIVADO,URBANA,CERRADA TEMPORALMENTE,MONOLINGUE,NOCTURNA,DIARIO(REGULAR),HUEHUETENANGO
13-01-6423-46,13-004,HUEHUETENANGO,HUEHUETENANGO,LICEO CANADIENSE DEL NOR OCCIDENTE,"8A. CALLE A 10-82 ZONA 1 7MA. CALLE 12-75, ZONA 5, COLONIA LA HONDONADA",77657888,CLARA ARMIDA MORALES CASTILLO,JULIO RENɠCALDERӎ FLORES,DIVERSIFICADO,PRIVADO,URBANA,ABIERTA,MONOLINGUE,DOBLE,FIN DE SEMANA,HUEHUETENANGO
13-01-6435-46,13-050,HUEHUETENANGO,HUEHUETENANGO,COLEGIO INTEGRAL EMPRESARIAL POR MADUREZ CIEM,2A. CALLE 8-79 COLONIA LO DE HERNANDEZ ZONA 7,77619224,REYNALDO RECINOS CASTILLO,ELVIN EZEQUIAS ALONZO PɒEZ,DIVERSIFICADO,PRIVADO,URBANA,CERRADA TEMPORALMENTE,MONOLINGUE,DOBLE,FIN DE SEMANA,HUEHUETENANGO
13-01-6725-46,13-050,HUEHUETENANGO,HUEHUETENANGO,LICEO EVANGELICO MIXTO 'MONTE SINAI',1A. CALLE 0-34 ZONA 1,77690723,REYNALDO RECINOS CASTILLO,,DIVERSIFICADO,PRIVADO,URBANA,CERRADA TEMPORALMENTE,MONOLINGUE,VESPERTINA,DIARIO(REGULAR),HUEHUETENANGO
13-01-6778-46,13-004,HUEHUETENANGO,HUEHUETENANGO,"COLEGIO PRIVADO MIXTO ""NUEVO AMANECER""",3A. AVENIDA FINAL ZONA 3,77657960,CLARA ARMIDA MORALES CASTILLO,DMARIS JULISSA VILLATORO RECINOS,DIVERSIFICADO,PRIVADO,URBANA,ABIERTA,MONOLINGUE,DOBLE,FIN DE SEMANA,HUEHUETENANGO
13-01-6780-46,13-004,HUEHUETENANGO,HUEHUETENANGO,"COLEGIO PRIVADO MIXTO ""NUEVO AMANECER""",3AV. FINAL ZONA 3,77657960,CLARA ARMIDA MORALES CASTILLO,EDWIN ROLANDO SALAZAR ESCOBEDO,DIVERSIFICADO,PRIVADO,URBANA,CERRADA TEMPORALMENTE,MONOLINGUE,DOBLE,FIN DE SEMANA,HUEHUETENANGO
13-01-6789-46,13-050,HUEHUETENANGO,HUEHUETENANGO,COLEGIO PRIVADO MIXTO RAFAEL LANDIVAR,5A. CALLE 11-66 ZONA 1,49664813,REYNALDO RECINOS CASTILLO,FLOR DE MARIA CASTILLO LӐEZ,DIVERSIFICADO,PRIVADO,URBANA,ABIERTA,MONOLINGUE,MATUTINA,DIARIO(REGULAR),HUEHUETENANGO
13-01-6791-46,13-050,HUEHUETENANGO,HUEHUETENANGO,CENTRO TECNOLOGICO AVANZADO CETA,4TA. AV. 0-49 COLONIA ALVARADO ZONA 5,79474572,REYNALDO RECINOS CASTILLO,,DIVERSIFICADO,PRIVADO,URBANA,CERRADA TEMPORALMENTE,MONOLINGUE,MATUTINA,DIARIO(REGULAR),HUEHUETENANGO
13-01-6885-46,13-004,HUEHUETENANGO,HUEHUETENANGO,LICEO PREUNIVERSITARIO EMPRESARIAL DEL NOROCCIDENTE,5AV. 7-147 ZONA 1,77641004,CLARA ARMIDA MORALES CASTILLO,,DIVERSIFICADO,PRIVADO,URBANA,TEMPORAL TITULOS,MONOLINGUE,VESPERTINA,DIARIO(REGULAR),HUEHUETENANGO
13-01-6926-46,13-050,HUEHUETENANGO,HUEHUETENANGO,COLEGIO MIXTO BILINGUE TECNOLOGICO FELIPE RINALDI,2A. CALLE 11-76 ZONA 4,,REYNALDO RECINOS CASTILLO,,DIVERSIFICADO,PRIVADO,URBANA,CERRADA TEMPORALMENTE,MONOLINGUE,MATUTINA,DIARIO(REGULAR),HUEHUETENANGO
13-01-6951-46,13-004,HUEHUETENANGO,HUEHUETENANGO,COLEGIO PRIVADO MIXTO HERMANO PEDRO,ZACULEU CENTRAL ZONA 9,57699663,CLARA ARMIDA MORALES CASTILLO,LILIA CARMELA LӐEZ LӐEZ,DIVERSIFICADO,PRIVADO,URBANA,ABIERTA,MONOLINGUE,DOBLE,FIN DE SEMANA,HUEHUETENANGO
13-01-6952-46,13-004,HUEHUETENANGO,HUEHUETENANGO,COLEGO PRIVADO MIXTO HERMANO PEDRO,ZACULEU CENTRAL ZONA 9,,CLARA ARMIDA MORALES CASTILLO,LILIA CARMELA LӐEZ LӐEZ,DIVERSIFICADO,PRIVADO,URBANA,CERRADA TEMPORALMENTE,MONOLINGUE,DOBLE,FIN DE SEMANA,HUEHUETENANGO
13-01-7082-46,13-050,HUEHUETENANGO,HUEHUETENANGO,LICEO PRIVADO MIXTO MONTESSORI,ALDEA CHINACA,,REYNALDO RECINOS CASTILLO,,DIVERSIFICADO,PRIVADO,URBANA,CERRADA TEMPORALMENTE,MONOLINGUE,DOBLE,FIN DE SEMANA,HUEHUETENANGO
13-01-7083-46,13-050,HUEHUETENANGO,HUEHUETENANGO,LICEO PRIVADO MIXTO MONTESSORI,ALDEA CHINACA,,REYNALDO RECINOS CASTILLO,,DIVERSIFICADO,PRIVADO,URBANA,CERRADA TEMPORALMENTE,MONOLINGUE,DOBLE,FIN DE SEMANA,HUEHUETENANGO
13-01-7090-46,13-050,HUEHUETENANGO,HUEHUETENANGO,COLEGIO CRISTIANO TABERNACULO DE LA FE,SECTOR IV CAMBOTE ZONA 11,79344338,REYNALDO RECINOS CASTILLO,EUSTAQUIO GӍEZ GӍEZ,DIVERSIFICADO,PRIVADO,RURAL,ABIERTA,MONOLINGUE,MATUTINA,DIARIO(REGULAR),HUEHUETENANGO
13-01-7099-46,13-050,HUEHUETENANGO,HUEHUETENANGO,COLEGIO PRIVADO MIXTO LA SABIDURIA,SEGUNDA CALLE ZONA SIETE LO DE HERNANDEZ,79596538,REYNALDO RECINOS CASTILLO,,DIVERSIFICADO,PRIVADO,URBANA,CERRADA TEMPORALMENTE,MONOLINGUE,VESPERTINA,DIARIO(REGULAR),HUEHUETENANGO
13-01-7110-46,13-004,HUEHUETENANGO,HUEHUETENANGO,INSTITUTO IBEROAMERICANO DE ESTUDIOS AVANZADOS,13 CALLE 2-20 COLONIA LOS ENCINOS ZONA 5 OFICINAS 205,59762130,CLARA ARMIDA MORALES CASTILLO,MIGUEL ANGEL PISQUIY QUIXTN,DIVERSIFICADO,PRIVADO,URBANA,CERRADA TEMPORALMENTE,MONOLINGUE,MATUTINA,A DISTANCIA,HUEHUETENANGO
13-01-7111-46,13-004,HUEHUETENANGO,HUEHUETENANGO,COLEGIO EVANGELICO PARA ADULTOS GUATEMALTECOS 'EL SHADDAI',COLONIA MAKEPEACE ZONA 1,77643534,CLARA ARMIDA MORALES CASTILLO,LUDDWIK MISSAEL GӍEZ RIVAS,DIVERSIFICADO,PRIVADO,URBANA,ABIERTA,MONOLINGUE,DOBLE,FIN DE SEMANA,HUEHUETENANGO
13-01-7130-46,13-050,HUEHUETENANGO,HUEHUETENANGO,COLEGIO CRISTIANO 'TABERNACULO DE LA FE',SECTOR IV CAMBOTE ZONA 11,77643006,REYNALDO RECINOS CASTILLO,,DIVERSIFICADO,PRIVADO,RURAL,CERRADA TEMPORALMENTE,MONOLINGUE,MATUTINA,DIARIO(REGULAR),HUEHUETENANGO
13-01-7133-46,13-004,HUEHUETENANGO,HUEHUETENANGO,COLEGIO EVANGELICO PARA ADULTOS GUATEMALTECOS 'EL SHADDAI',COLONIA MAKEPEACE ZONA 1,77643534,CLARA ARMIDA MORALES CASTILLO,LUDDWIK MISSAEL GӍEZ RIVAS,DIVERSIFICADO,PRIVADO,URBANA,CERRADA TEMPORALMENTE,MONOLINGUE,DOBLE,FIN DE SEMANA,HUEHUETENANGO
13-01-7142-46,13-004,HUEHUETENANGO,HUEHUETENANGO,COLEGIO PRIVADO MIXTO AMERICANO,3A. AVENIDA 1-140 ZONA 3,77649739,CLARA ARMIDA MORALES CASTILLO,JAIME LUIS LӐEZ MENDӚA,DIVERSIFICADO,PRIVADO,URBANA,ABIERTA,MONOLINGUE,DOBLE,FIN DE SEMANA,HUEHUETENANGO
13-01-7148-46,13-050,HUEHUETENANGO,HUEHUETENANGO,CENTRO EDUCATIVO A DISTANCIA AULA VIRTUAL,"2A. CALLE 6-49, ZONA 1",77648978,REYNALDO RECINOS CASTILLO,OLIVER BOANERGES RECINOS RECINOS,DIVERSIFICADO,PRIVADO,URBANA,CERRADA TEMPORALMENTE,MONOLINGUE,DOBLE,DIARIO(REGULAR),HUEHUETENANGO
13-02-0166-46,13-005,HUEHUETENANGO,CHIANTLA,ESCUELA NACIONAL DE CIENCIAS COMERCIALES,3A. CALLE 6-45 ZONA 5,77644480,YURI ESTEBAN LEӎ REYES,GONZALO EZEQUIEL MɒIDA MɒIDA,DIVERSIFICADO,OFICIAL,URBANA,ABIERTA,MONOLINGUE,VESPERTINA,DIARIO(REGULAR),HUEHUETENANGO
13-02-0194-46,13-006,HUEHUETENANGO,CHIANTLA,INSTITUTO BASICO EXPERIMENTAL CON ORIENTACION OCUPACIONAL FE Y ALEGRIA NO. 38,ALDEA CHUSCAJ,77644550,MAŔ ELENA MAT́S ANTONIO DE MONTEJO,GERVIN GEOVANI JUSTINIANO CASTAхDA,DIVERSIFICADO,PRIVADO,RURAL,ABIERTA,MONOLINGUE,VESPERTINA,DIARIO(REGULAR),HUEHUETENANGO
13-02-0195-46,13-005,HUEHUETENANGO,CHIANTLA,COLEGIO INTEGRAL HUMANISTICO CHIANTLECO,CANTON LA LAGUNITA ZONA 3,77659286,YURI ESTEBAN LEӎ REYES,JOSɠRENɠTELLO MɒIDA,DIVERSIFICADO,PRIVADO,URBANA,ABIERTA,MONOLINGUE,VESPERTINA,DIARIO(REGULAR),HUEHUETENANGO
13-02-0196-46,13-007,HUEHUETENANGO,CHIANTLA,INSTITUTO NORMAL MIXTO,"CANTON LOS PLANES DEL CORDERO, ALDEA LA CAPELLANIA",49000057,LUIS ANTONIO HERRERA TELLO,VERӎICA PAOLA CIFUENTES AGUILAR,DIVERSIFICADO,OFICIAL,RURAL,CERRADA TEMPORALMENTE,MONOLINGUE,MATUTINA,DIARIO(REGULAR),HUEHUETENANGO
13-02-0209-46,13-005,HUEHUETENANGO,CHIANTLA,"COLEGIO ""JUAN PABLO II""",5A. AV. 4-13 ZONA 1,58014531,YURI ESTEBAN LEӎ REYES,MARIA VIRGINIA GOMEZ MENDEZ DE ALVA,DIVERSIFICADO,PRIVADO,URBANA,CERRADA TEMPORALMENTE,MONOLINGUE,VESPERTINA,DIARIO(REGULAR),HUEHUETENANGO
13-02-0210-46,13-005,HUEHUETENANGO,CHIANTLA,"COLEGIO ""JUAN PABLO II""",5A. AV. 4-13 ZONA 1,59775141,YURI ESTEBAN LEӎ REYES,MAIRA VIRGINIA GӍEZ MɎDEZ,DIVERSIFICADO,PRIVADO,URBANA,CERRADA TEMPORALMENTE,MONOLINGUE,DOBLE,FIN DE SEMANA,HUEHUETENANGO
13-02-0216-46,13-005,HUEHUETENANGO,CHIANTLA,COLEGIO INTEGRAL HUMANISTICO CHIANTLECO,CANTON LA LAGUNITA ZONA 3,30034627,YURI ESTEBAN LEӎ REYES,EMIL JOSɠTELLO LӐEZ,DIVERSIFICADO,PRIVADO,URBANA,ABIERTA,MONOLINGUE,DOBLE,FIN DE SEMANA,HUEHUETENANGO
13-02-0217-46,13-005,HUEHUETENANGO,CHIANTLA,COLEGIO INTEGRAL HUMANISTICO CHIANTLECO,CANTON LA LAGUNITA ZONA 3,77659286,YURI ESTEBAN LEӎ REYES,EMIL JOSɠTELLO LӐEZ,DIVERSIFICADO,PRIVADO,URBANA,CERRADA TEMPORALMENTE,MONOLINGUE,DOBLE,FIN DE SEMANA,HUEHUETENANGO
13-02-0238-46,13-006,HUEHUETENANGO,CHIANTLA,"COLEGIO PRIVADO MIXTO ""RIO QUISIL""",ALDEA SAN FRANCISCO LAS FLORES,40586074,MAŔ ELENA MAT́S ANTONIO DE MONTEJO,MAYNOR ALBERTO VELSQUEZ CHVEZ,DIVERSIFICADO,PRIVADO,RURAL,CERRADA TEMPORALMENTE,MONOLINGUE,DOBLE,FIN DE SEMANA,HUEHUETENANGO
13-02-0239-46,13-005,HUEHUETENANGO,CHIANTLA,"COLEGIO PRIVADO MIXTO ""LOS ANDES""","CANTӎ NUEVA ESPERANZA, ALDEA R͏ ESCONDIDO",57486992,YURI ESTEBAN LEӎ REYES,INɓ FRUTO LӐEZ LӐEZ,DIVERSIFICADO,PRIVADO,RURAL,ABIERTA,MONOLINGUE,VESPERTINA,DIARIO(REGULAR),HUEHUETENANGO
13-02-0240-46,13-005,HUEHUETENANGO,CHIANTLA,"COLEGIO PRIVADO MIXTO ""LOS ANDES""","CANTӎ NUEVA ESPERANZA, ALDEA R͏ ESCONDIDO",40586074,YURI ESTEBAN LEӎ REYES,INɓ FRUTO LӐEZ LӐEZ,DIVERSIFICADO,PRIVADO,RURAL,CERRADA TEMPORALMENTE,MONOLINGUE,DOBLE,FIN DE SEMANA,HUEHUETENANGO
13-02-0267-46,13-005,HUEHUETENANGO,CHIANTLA,"COLEGIO ""JUAN PABLO II""","EOU PARA NIсS 5A. AVENIDA 4-13, ZONA 1",42077930,YURI ESTEBAN LEӎ REYES,MAIRA VIRGINIA GӍEZ MɎDEZ,DIVERSIFICADO,PRIVADO,URBANA,ABIERTA,MONOLINGUE,VESPERTINA,DIARIO(REGULAR),HUEHUETENANGO
13-02-0286-46,13-006,HUEHUETENANGO,CHIANTLA,"COLEGIO PRIVADO MIXTO ""RIO QUISIL""",ALDEA SAN FRANCISCO LAS FLORES,40586074,MAŔ ELENA MAT́S ANTONIO DE MONTEJO,MAYNOR ALBERTO VELSQUEZ CHVEZ,DIVERSIFICADO,PRIVADO,RURAL,CERRADA TEMPORALMENTE,MONOLINGUE,VESPERTINA,DIARIO(REGULAR),HUEHUETENANGO
13-02-0290-46,13-005,HUEHUETENANGO,CHIANTLA,"COLEGIO ""JUAN PABLOII""",5TA. AVENDIA 4-13 ZONA 1,58014531,YURI ESTEBAN LEӎ REYES,MAIRA VIRGINIA GӍEZ MɎDEZ,DIVERSIFICADO,PRIVADO,URBANA,ABIERTA,MONOLINGUE,DOBLE,FIN DE SEMANA,HUEHUETENANGO
13-02-0296-46,13-005,HUEHUETENANGO,CHIANTLA,COLEGIO INTEGRAL HUMANISTICO CHIANTLECO,CANTӎ LA LAGUNITA ZONA 3 CHIANTLA,77659286,YURI ESTEBAN LEӎ REYES,JOSɠRENɠTELLO MɒIDA,DIVERSIFICADO,PRIVADO,URBANA,ABIERTA,MONOLINGUE,MATUTINA,DIARIO(REGULAR),HUEHUETENANGO
13-02-0306-46,13-005,HUEHUETENANGO,CHIANTLA,COLEGIO PARROQUIAL NUESTRA SEяRA DE CANDELARIA,CANTӎ PARROQUIA,77253152,YURI ESTEBAN LEӎ REYES,SILVIA YANIRA TIG܉L`MART͎EZ,DIVERSIFICADO,PRIVADO,URBANA,ABIERTA,MONOLINGUE,VESPERTINA,DIARIO(REGULAR),HUEHUETENANGO
13-02-0307-46,13-060,HUEHUETENANGO,CHIANTLA,CENTRO DE EDUCACIӎ EXTRAESCOLAR CEEX FE Y ALEGŔ NO. 12,"ALDEA CHUSCAJ, ZONA 4 CHIANTLA",77644550,AROLDO HOSBERI SOSA LӐEZ,GERVIN GEOVANI JUSTINIANO CASTAхDA,DIVERSIFICADO,PRIVADO,RURAL,ABIERTA,MONOLINGUE,DOBLE,DIARIO(REGULAR),HUEHUETENANGO
13-02-0308-46,13-060,HUEHUETENANGO,CHIANTLA,"CENTRO DE EDUCACIӎ EXTRAESCOLAR CEEX- CENTRO DE EDUCACIӎ BSICA ALTERNATIVA DE CHIANTLA PMF""",CABECERA MUNICIPAL,32344761,AROLDO HOSBERI SOSA LӐEZ,BRANLY GUDIEL GӍEZ GӍEZ,DIVERSIFICADO,PRIVADO,URBANA,ABIERTA,MONOLINGUE,DOBLE,FIN DE SEMANA,HUEHUETENANGO
13-02-0312-46,13-060,HUEHUETENANGO,CHIANTLA,CENTRO DE EDUCACIӎ EXTRAESCOLAR CEEX,ALDEA BUENOS AIRES,45033326,AROLDO HOSBERI SOSA LӐEZ,CATHY YESENIA IMUL US,DIVERSIFICADO,PRIVADO,RURAL,CERRADA TEMPORALMENTE,MONOLINGUE,DOBLE,DIARIO(REGULAR),HUEHUETENANGO
13-02-0313-46,13-005,HUEHUETENANGO,CHIANTLA,COLEGIO INTEGRAL HUMAN͓TICO CHIANTLECO,CANTӎ LA LAGUNITA ZONA 3,77644240,YURI ESTEBAN LEӎ REYES,EMIL JOSɠTELLO LӐEZ,DIVERSIFICADO,PRIVADO,URBANA,ABIERTA,MONOLINGUE,SIN JORNADA,SEMIPRESENCIAL (UN D́ A LA SEMANA),HUEHUETENANGO
13-02-0317-46,13-005,HUEHUETENANGO,CHIANTLA,COLEGIO JUAN PABLO II,5A. AVENIDA 4-13 ZONA 1,30678846,YURI ESTEBAN LEӎ REYES,MAIRA VIRGINIA GӍEZ MɎDEZ,DIVERSIFICADO,PRIVADO,URBANA,ABIERTA,MONOLINGUE,SIN JORNADA,SEMIPRESENCIAL (UN D́ A LA SEMANA),HUEHUETENANGO
13-02-0319-46,13-005,HUEHUETENANGO,CHIANTLA,"COLEGIO PRIVADO MIXTO ""LOS ANDES""",CANTӎ NUEVA ESPERANZA ALDEA R͏ ESCONDIDO,40318789,YURI ESTEBAN LEӎ REYES,INɓ FRUTO LӐEZ LӐEZ,DIVERSIFICADO,PRIVADO,RURAL,ABIERTA,MONOLINGUE,SIN JORNADA,SEMIPRESENCIAL (UN D́ A LA SEMANA),HUEHUETENANGO
13-02-0324-46,13-005,HUEHUETENANGO,CHIANTLA,COLEGIO PARROQUIAL NUESTRA SEяRA DE CANDELARIA,CANTӎ PARROQUIA ZONA 1,77253152,YURI ESTEBAN LEӎ REYES,SILVIA YANIRA TIG܉L`MART͎EZ,DIVERSIFICADO,PRIVADO,URBANA,ABIERTA,MONOLINGUE,MATUTINA,DIARIO(REGULAR),HUEHUETENANGO
13-02-0325-46,13-006,HUEHUETENANGO,CHIANTLA,"COLEGIO PRIVADO MIXTO ""RIO QUISIL""",ALDEA CHӃHAL,46584251,MAŔ ELENA MAT́S ANTONIO DE MONTEJO,MAYNOR ALBERTO VELSQUEZ CHVEZ,DIVERSIFICADO,PRIVADO,RURAL,ABIERTA,MONOLINGUE,SIN JORNADA,SEMIPRESENCIAL (UN D́ A LA SEMANA),HUEHUETENANGO
13-02-0326-46,13-006,HUEHUETENANGO,CHIANTLA,"COLEGIO PRIVADO MIXTO ""RIO QUISIL""",ALDEA CHӃHAL,46584251,MAŔ ELENA MAT́S ANTONIO DE MONTEJO,MAYNOR ALBERTO VELSQUEZ CHVEZ,DIVERSIFICADO,PRIVADO,RURAL,ABIERTA,MONOLINGUE,VESPERTINA,DIARIO(REGULAR),HUEHUETENANGO
13-02-6384-46,13-005,HUEHUETENANGO,CHIANTLA,COLEGIO PRIVADO MIXTO GENESIS,11 AV. 8-25 ZONA 3,,YURI ESTEBAN LEӎ REYES,,DIVERSIFICADO,PRIVADO,URBANA,TEMPORAL TITULOS,MONOLINGUE,VESPERTINA,DIARIO(REGULAR),HUEHUETENANGO
13-03-0047-46,13-009,HUEHUETENANGO,MALACATANCITO,COLEGIO PRIVADO MIXTO XEPON,ALDEA XEPON GRANDE,47838773,AUGUSTO RENɠCASTILLO AGUIRRE,APOLONIO MARINO RODR͇UEZ MORALES,DIVERSIFICADO,PRIVADO,RURAL,ABIERTA,MONOLINGUE,DOBLE,FIN DE SEMANA,HUEHUETENANGO
